[{"page_link":"https://obamawhitehouse.archives.gov/photos-and-video/video/2017/01/17/11717-white-house-press-briefing","title":"1/17/17: White House Press Briefing","published_date":"2017-01-17T00:00:00+00:00","content":"https://obamawhitehouse.archives.gov/videos/2017/January/20170117_Press_Briefing.mp3","author":"the White House"},{"page_link":"https://obamawhitehouse.archives.gov/photos-and-video/video/2017/01/13/11317-white-house-press-briefing","title":"1/13/17: White House Press Briefing","published_date":"2017-01-13T00:00:00+00:00","content":"https://obamawhitehouse.archives.gov/videos/2017/January/20170113_Press_Briefing.mp3","author":"the White House"},{"page_link":"https://obamawhitehouse.archives.gov/photos-and-video/video/2017/01/12/11217-white-house-press-briefing","title":"1/12/17: White House Press Briefing","published_date":"2017-01-12T00:00:00+00:00","content":"https://obamawhitehouse.archives.gov/videos/2017/January/20170112_Press_Briefing.mp3","author":"the White House"},{"page_link":"https://obamawhitehouse.archives.gov/photos-and-video/video/2017/01/11/11117-white-house-press-briefing","title":"1/11/17: White House Press Briefing","published_date":"2017-01-11T00:00:00+00:00","content":"https://obamawhitehouse.archives.gov/videos/2017/January/20170111_Press_Briefing.mp3","author":"the White House"},{"page_link":"https://obamawhitehouse.archives.gov/photos-and-video/video/2017/01/09/1917-white-house-press-briefing","title":"1/9/17: White House Press Briefing","published_date":"2017-01-09T00:00:00+00:00","content":"https://obamawhitehouse.archives.gov/videos/2017/January/20170109_Press_Briefing.mp3","author":"the White House"},{"page_link":"https://obamawhitehouse.archives.gov/photos-and-video/video/2017/01/06/1617-white-house-press-briefing","title":"1/6/17: White House Press Briefing","published_date":"2017-01-06T00:00:00+00:00","content":"https://obamawhitehouse.archives.gov/videos/2017/January/20170106_Press_Briefing.mp3","author":"the White House"},{"page_link":"https://obamawhitehouse.archives.gov/photos-and-video/video/2017/01/05/1517-white-house-press-briefing","title":"1/5/17: White House Press Briefing","published_date":"2017-01-05T00:00:00+00:00","content":"https://obamawhitehouse.archives.gov/videos/2017/January/20170105_DPB.mp3","author":"the White House"},{"page_link":"https://obamawhitehouse.archives.gov/photos-and-video/video/2017/01/04/1417-white-house-press-briefing","title":"1/4/17: White House Press Briefing","published_date":"2017-01-04T00:00:00+00:00","content":"https://obamawhitehouse.archives.gov/videos/2017/January/20170104_Press_Briefing.mp3","author":"the White House"},{"page_link":"https://obamawhitehouse.archives.gov/photos-and-video/video/2017/01/03/1317-white-house-press-briefing","title":"1/3/17: White House Press Briefing","published_date":"2017-01-03T00:00:00+00:00","content":"https://obamawhitehouse.archives.gov/videos/2017/January/20170103_Press_Briefing.mp3","author":"the White House"},{"page_link":"https://obamawhitehouse.archives.gov/photos-and-video/video/2016/12/15/121516-white-house-press-briefing","title":"12/15/16: White House Press Briefing","published_date":"2016-12-15T00:00:00+00:00","content":"https://obamawhitehouse.archives.gov/videos/2016/December/20161215_Press_Briefing.mp3","author":"the White House"},{"page_link":"https://obamawhitehouse.archives.gov/photos-and-video/video/2016/12/14/121416-white-house-press-briefing","title":"12/14/16: White House Press Briefing","published_date":"2016-12-14T00:00:00+00:00","content":"https://obamawhitehouse.archives.gov/videos/2016/December/20161214_Daily_Press_Briefing.mp3","author":"the White House"},{"page_link":"https://obamawhitehouse.archives.gov/photos-and-video/video/2016/12/13/121316-white-house-press-briefing","title":"12/13/16: White House Press Briefing","published_date":"2016-12-13T00:00:00+00:00","content":"https://obamawhitehouse.archives.gov/videos/2016/December/20161213_Daily_Press_Briefing.mp3","author":"the White House"},{"page_link":"https://obamawhitehouse.archives.gov/photos-and-video/video/2016/12/12/121216-white-house-press-briefing","title":"12/12/16: White House Press Briefing","published_date":"2016-12-12T00:00:00+00:00","content":"https://obamawhitehouse.archives.gov/videos/2016/December/20161212_Daily_Press_Briefing.mp3","author":"the White House"},{"page_link":"https://obamawhitehouse.archives.gov/photos-and-video/video/2016/12/09/12916-white-house-press-briefing","title":"12/9/16: White House Press Briefing","published_date":"2016-12-09T00:00:00+00:00","content":"https://obamawhitehouse.archives.gov/videos/2016/December/20161209_Press_Briefing.mp3","author":"the White House"},{"page_link":"https://obamawhitehouse.archives.gov/photos-and-video/video/2016/12/08/12816-white-house-press-briefing","title":"12/8/16: White House Press Briefing","published_date":"2016-12-08T00:00:00+00:00","content":"https://obamawhitehouse.archives.gov/videos/2016/December/20161208_Press_Briefing.mp3","author":"the White House"},{"page_link":"https://obamawhitehouse.archives.gov/photos-and-video/video/2016/12/07/12716-white-house-press-briefing","title":"12/7/16: White House Press Briefing","published_date":"2016-12-07T00:00:00+00:00","content":"https://obamawhitehouse.archives.gov/videos/2016/December/20161207_Press_Briefing.mp3","author":"the White House"},{"page_link":"https://obamawhitehouse.archives.gov/photos-and-video/video/2016/12/02/120216-white-house-press-briefing","title":"12/02/16: White House Press Briefing","published_date":"2016-12-02T00:00:00+00:00","content":"https://obamawhitehouse.archives.gov/videos/2016/December/20161202_Press_Briefing.mp3","author":"the White House"},{"page_link":"https://obamawhitehouse.archives.gov/photos-and-video/video/2016/12/01/120116-white-house-press-briefing","title":"12/01/16: White House Press Briefing","published_date":"2016-12-01T00:00:00+00:00","content":"https://obamawhitehouse.archives.gov/videos/2016/December/20161201_Press_Brefing.mp3","author":"the White House"},{"page_link":"https://obamawhitehouse.archives.gov/photos-and-video/video/2016/11/30/113016-white-house-press-briefing","title":"11/30/16: White House Press Briefing","published_date":"2016-11-30T00:00:00+00:00","content":"https://obamawhitehouse.archives.gov/videos/2016/November/20161130_Press_Briefing.mp3","author":"the White House"},{"page_link":"https://obamawhitehouse.archives.gov/photos-and-video/video/2016/11/29/112916-white-house-press-briefing","title":"11/29/16: White House Press Briefing","published_date":"2016-11-29T00:00:00+00:00","content":"https://obamawhitehouse.archives.gov/videos/2016/November/20161129_Press_Briefing.mp3","author":"the White House"},{"page_link":"https://obamawhitehouse.archives.gov/photos-and-video/video/2016/11/28/112816-white-house-press-briefing","title":"11/28/16: White House Press Briefing","published_date":"2016-11-28T00:00:00+00:00","content":"https://obamawhitehouse.archives.gov/videos/2016/November/20161128_Press_Briefing.mp3","author":"the White House"},{"page_link":"https://obamawhitehouse.archives.gov/photos-and-video/video/2016/11/22/112216-white-house-press-briefing","title":"11/22/16: White House Press Briefing","published_date":"2016-11-22T00:00:00+00:00","content":"https://obamawhitehouse.archives.gov/videos/2016/November/20161122_DPB.mp3","author":"the White House"},{"page_link":"https://obamawhitehouse.archives.gov/photos-and-video/video/2016/11/10/111016-white-house-press-briefing","title":"11/10/16: White House Press Briefing","published_date":"2016-11-10T00:00:00+00:00","content":"https://obamawhitehouse.archives.gov/videos/2016/November/20161110_Press_Briefing.mp3","author":"the White House"},{"page_link":"https://obamawhitehouse.archives.gov/photos-and-video/video/2016/11/09/11916-white-house-press-briefing","title":"11/9/16: White House Press Briefing ","published_date":"2016-11-09T00:00:00+00:00","content":"https://obamawhitehouse.archives.gov/videos/2016/November/20161109_Press_Briefing.mp3","author":"the White House"},{"page_link":"https://obamawhitehouse.archives.gov/photos-and-video/video/2016/10/27/102716-white-house-press-briefing","title":"10/27/16: White House Press Briefing","published_date":"2016-10-27T00:00:00+00:00","content":"https://obamawhitehouse.archives.gov/videos/2016/October/20161027_Press_Briefing.mp3","author":"the White House"},{"page_link":"https://obamawhitehouse.archives.gov/photos-and-video/video/2016/10/21/102116-white-house-press-briefing","title":"10/21/16: White House Press Briefing","published_date":"2016-10-21T00:00:00+00:00","content":"https://obamawhitehouse.archives.gov/videos/2016/October/20161021_Press_Briefing.mp3","author":"the White House"},{"page_link":"https://obamawhitehouse.archives.gov/photos-and-video/video/2016/10/19/101916-white-house-press-briefing","title":"10/19/16: White House Press Briefing","published_date":"2016-10-19T00:00:00+00:00","content":"https://obamawhitehouse.archives.gov/videos/2016/October/20161019_Press_Briefing.mp3","author":"the White House"},{"page_link":"https://obamawhitehouse.archives.gov/photos-and-video/video/2016/10/17/101716-white-house-press-briefing","title":"10/17/16: White House Press Briefing","published_date":"2016-10-17T00:00:00+00:00","content":"https://obamawhitehouse.archives.gov/videos/2016/October/20161017_Press_Briefing.mp3","author":"the White House"},{"page_link":"https://obamawhitehouse.archives.gov/photos-and-video/video/2016/10/12/101216-white-house-press-briefing","title":"10/12/16: White House Press Briefing","published_date":"2016-10-12T00:00:00+00:00","content":"https://obamawhitehouse.archives.gov/videos/2016/October/20161012_Press_Briefing.mp3","author":"the White House"},{"page_link":"https://obamawhitehouse.archives.gov/photos-and-video/video/2016/10/06/10616-white-house-press-briefing-0","title":"10/6/16: White House Press Briefing","published_date":"2016-10-06T00:00:00+00:00","content":"https://obamawhitehouse.archives.gov/videos/2016/October/20161006_Press_Briefing.mp3","author":"the White House"},{"page_link":"https://obamawhitehouse.archives.gov/photos-and-video/video/2016/10/06/10616-white-house-press-briefing","title":"10/6/16: White House Press Briefing","published_date":"2016-10-06T00:00:00+00:00","content":"https://obamawhitehouse.archives.gov/videos/2016/October/20161006_Press_Briefing.mp3","author":"the White House"},{"page_link":"https://obamawhitehouse.archives.gov/photos-and-video/video/2016/10/05/10516-white-house-press-briefing","title":"10/5/16: White House Press Briefing","published_date":"2016-10-05T00:00:00+00:00","content":"https://obamawhitehouse.archives.gov/videos/2016/October/20161005_Press_Briefing.mp3","author":"the White House"},{"page_link":"https://obamawhitehouse.archives.gov/photos-and-video/video/2016/10/04/10416-white-house-press-briefing","title":"10/4/16: White House Press Briefing","published_date":"2016-10-04T00:00:00+00:00","content":"https://obamawhitehouse.archives.gov/videos/2016/October/20161004_Press_Briefing.mp3","author":"the White House"},{"page_link":"https://obamawhitehouse.archives.gov/photos-and-video/video/2016/10/03/10316-white-house-press-briefing","title":"10/3/16: White House Press Briefing","published_date":"2016-10-03T00:00:00+00:00","content":"https://obamawhitehouse.archives.gov/videos/2016/October/20161003_Press_Briefing.mp3","author":"the White House"},{"page_link":"https://obamawhitehouse.archives.gov/photos-and-video/video/2016/09/29/92916-white-house-press-briefing","title":"9/29/16: White House Press Briefing","published_date":"2016-09-29T00:00:00+00:00","content":"https://obamawhitehouse.archives.gov/videos/2016/September/20160929_Press_Briefing.mp3","author":"the White House"},{"page_link":"https://obamawhitehouse.archives.gov/photos-and-video/video/2016/09/27/92716-white-house-press-briefing","title":"9/27/16: White House Press Briefing","published_date":"2016-09-27T00:00:00+00:00","content":"https://obamawhitehouse.archives.gov/videos/2016/September/20160927_Press_Briefing_HD.mp3","author":"the White House"},{"page_link":"https://obamawhitehouse.archives.gov/photos-and-video/video/2016/09/23/92316-white-house-press-briefing","title":"9/23/16: White House Press Briefing","published_date":"2016-09-23T00:00:00+00:00","content":"https://obamawhitehouse.archives.gov/videos/2016/September/20160923_Press_Briefing-1.mp3","author":"the White House"},{"page_link":"https://obamawhitehouse.archives.gov/photos-and-video/video/2016/09/22/9222016-white-house-press-briefing","title":"9/22/2016: White House Press Briefing","published_date":"2016-09-22T00:00:00+00:00","content":"https://obamawhitehouse.archives.gov/videos/2016/September/20160922_Press_Briefing.mp3","author":"the White House"},{"page_link":"https://obamawhitehouse.archives.gov/photos-and-video/video/2016/09/20/92016-white-house-press-briefing","title":"9/20/16: White House Press Briefing","published_date":"2016-09-20T00:00:00+00:00","content":"https://obamawhitehouse.archives.gov/videos/2016/September/20160920_Press_Briefing.mp3","author":"the White House"},{"page_link":"https://obamawhitehouse.archives.gov/photos-and-video/video/2016/09/16/91616-white-house-press-briefing","title":"9/16/16: White House Press Briefing","published_date":"2016-09-16T00:00:00+00:00","content":"https://obamawhitehouse.archives.gov/videos/2016/September/20160916_Press_Briefing.mp3","author":"the White House"},{"page_link":"https://obamawhitehouse.archives.gov/photos-and-video/video/2016/09/15/091516-white-house-press-briefing","title":"09/15/16: White House Press Briefing","published_date":"2016-09-15T00:00:00+00:00","content":"https://obamawhitehouse.archives.gov/videos/2016/September/20160915_Press_Briefing.mp3","author":"the White House"},{"page_link":"https://obamawhitehouse.archives.gov/photos-and-video/video/2016/09/14/91416-white-house-press-briefing","title":"9/14/16: White House Press Briefing","published_date":"2016-09-14T00:00:00+00:00","content":"https://obamawhitehouse.archives.gov/videos/2016/September/20160914_Press_Briefing.mp3","author":"the White House"},{"page_link":"https://obamawhitehouse.archives.gov/photos-and-video/video/2016/09/12/091216-white-house-press-briefing","title":"09/12/16: White House Press Briefing","published_date":"2016-09-12T00:00:00+00:00","content":"https://obamawhitehouse.archives.gov/videos/2016/September/20160912_Press_Briefing.mp3","author":"the White House"},{"page_link":"https://obamawhitehouse.archives.gov/photos-and-video/video/2016/09/06/white-house-press-briefing","title":"White House Press Briefing","published_date":"2016-09-06T00:00:00+00:00","content":"https://obamawhitehouse.archives.gov/videos/2016/September/20160906_Press_Briefing.mp3","author":"the White House"},{"page_link":"https://obamawhitehouse.archives.gov/photos-and-video/video/2016/08/30/83016-white-house-press-briefing","title":"8/30/16: White House Press Briefing","published_date":"2016-08-30T00:00:00+00:00","content":"https://obamawhitehouse.archives.gov/videos/2016/August/20160830_Press_Briefing.mp3","author":"the White House"},{"page_link":"https://obamawhitehouse.archives.gov/photos-and-video/video/2016/08/29/82916-white-house-press-briefing","title":"8/29/16: White House Press Briefing","published_date":"2016-08-29T00:00:00+00:00","content":"https://obamawhitehouse.archives.gov/videos/2016/August/20160829_Press_Briefing.mp3","author":"the White House"},{"page_link":"https://obamawhitehouse.archives.gov/photos-and-video/video/2016/08/26/82616-white-house-press-briefing","title":"8/26/16: White House Press Briefing","published_date":"2016-08-26T00:00:00+00:00","content":"https://obamawhitehouse.archives.gov/videos/2016/August/20160826_Press_Briefing.mp3","author":"the White House"},{"page_link":"https://obamawhitehouse.archives.gov/photos-and-video/video/2016/08/25/82516-white-house-press-briefing","title":"8/25/16: White House Press Briefing","published_date":"2016-08-25T00:00:00+00:00","content":"https://obamawhitehouse.archives.gov/videos/2016/August/20160825_Press_Briefing.mp3","author":"the White House"},{"page_link":"https://obamawhitehouse.archives.gov/photos-and-video/video/2016/08/24/82416-white-house-press-briefing","title":"8/24/16: White House Press Briefing","published_date":"2016-08-24T00:00:00+00:00","content":"https://obamawhitehouse.archives.gov/videos/2016/August/20160824_Press_Briefing.mp3","author":"the White House"},{"page_link":"https://obamawhitehouse.archives.gov/photos-and-video/video/2016/08/22/82216-white-house-press-briefing","title":"8/22/16: White House Press Briefing","published_date":"2016-08-22T00:00:00+00:00","content":"https://obamawhitehouse.archives.gov/videos/2016/August/20160822_Press_Briefing.mp3","author":"the White House"},{"page_link":"https://obamawhitehouse.archives.gov/photos-and-video/video/2016/08/03/8316-white-house-press-briefing","title":"8/3/16: White House Press Briefing","published_date":"2016-08-03T00:00:00+00:00","content":"https://obamawhitehouse.archives.gov/videos/2016/August/20160803_Press_Briefing.mp3","author":"the White House"},{"page_link":"https://obamawhitehouse.archives.gov/photos-and-video/video/2016/07/29/72916-white-house-press-briefing","title":"7/29/16: White House Press Briefing","published_date":"2016-07-29T00:00:00+00:00","content":"https://obamawhitehouse.archives.gov/videos/2016/July/20160729_Press_Briefing.mp3","author":"the White House"},{"page_link":"https://obamawhitehouse.archives.gov/photos-and-video/video/2016/07/28/72816-white-house-press-briefing","title":"7/28/16: White House Press Briefing","published_date":"2016-07-28T00:00:00+00:00","content":"https://obamawhitehouse.archives.gov/videos/2016/July/20160728_Press_Briefing.mp3","author":"the White House"},{"page_link":"https://obamawhitehouse.archives.gov/photos-and-video/video/2016/07/22/president-obama-and-president-pe-nieto-hold-joint-press-conference","title":"President Obama and President Peña Nieto Hold a Joint Press Conference","published_date":"2016-07-22T00:00:00+00:00","content":"https://obamawhitehouse.archives.gov/videos/2016/July/20160722_POTUS_Press_Conference_with_President_of_Mexico.mp3","author":"the White House"},{"page_link":"https://obamawhitehouse.archives.gov/photos-and-video/video/2016/07/21/72116-white-house-press-briefing","title":"7/21/16: White House Press Briefing","published_date":"2016-07-21T00:00:00+00:00","content":"https://obamawhitehouse.archives.gov/videos/2016/July/20160721_Press_Briefing.mp3","author":"the White House"},{"page_link":"https://obamawhitehouse.archives.gov/photos-and-video/video/2016/07/19/71916-white-house-press-briefing-0","title":"7/19/16: White House Press Briefing","published_date":"2016-07-19T00:00:00+00:00","content":"https://obamawhitehouse.archives.gov/videos/2016/July/20160719_Press_Briefing.mp3","author":"the White House"},{"page_link":"https://obamawhitehouse.archives.gov/photos-and-video/video/2016/07/18/71816-white-house-press-briefing","title":"7/18/16: White House Press Briefing","published_date":"2016-07-18T00:00:00+00:00","content":"https://obamawhitehouse.archives.gov/videos/2016/July/20160718_Press_Briefing.mp3","author":"the White House"},{"page_link":"https://obamawhitehouse.archives.gov/photos-and-video/video/2016/07/15/71516-white-house-press-briefing","title":"7/15/16: White House Press Briefing","published_date":"2016-07-15T00:00:00+00:00","content":"https://obamawhitehouse.archives.gov/videos/2016/July/20160715_Press_Briefing.mp3","author":"the White House"},{"page_link":"https://obamawhitehouse.archives.gov/photos-and-video/video/2016/07/13/71316-white-house-press-briefing","title":"7/13/16: White House Press Briefing","published_date":"2016-07-13T00:00:00+00:00","content":"https://obamawhitehouse.archives.gov/videos/2016/July/20160713_Press_Briefing.mp3","author":"the White House"},{"page_link":"https://obamawhitehouse.archives.gov/photos-and-video/video/2016/07/11/71116-white-house-press-briefing","title":"7/11/16: White House Press Briefing","published_date":"2016-07-11T00:00:00+00:00","content":"https://obamawhitehouse.archives.gov/videos/2016/July/20160711_Press_Briefing.mp3","author":"the White House"},{"page_link":"https://obamawhitehouse.archives.gov/photos-and-video/video/2016/07/08/7816-white-house-press-briefing","title":"7/8/16: White House Press Briefing","published_date":"2016-07-08T00:00:00+00:00","content":"https://obamawhitehouse.archives.gov/videos/2016/July/20160708_Press_Briefing.mp3","author":"the White House"},{"page_link":"https://obamawhitehouse.archives.gov/photos-and-video/video/2016/07/01/7116-white-house-press-briefing","title":"7/1/16: White House Press Briefing","published_date":"2016-07-01T00:00:00+00:00","content":"https://obamawhitehouse.archives.gov/videos/2016/July/20160701_Press_Briefing.mp3","author":"the White House"},{"page_link":"https://obamawhitehouse.archives.gov/photos-and-video/video/2016/06/30/63016-white-house-press-briefing","title":"6/30/16: White House Press Briefing","published_date":"2016-06-30T00:00:00+00:00","content":"https://obamawhitehouse.archives.gov/videos/2016/June/20160630_Press_Briefing.mp3","author":"the White House"},{"page_link":"https://obamawhitehouse.archives.gov/photos-and-video/video/2016/06/28/62816-white-house-press-briefing","title":"6/28/16: White House Press Briefing","published_date":"2016-06-28T00:00:00+00:00","content":"https://obamawhitehouse.archives.gov/videos/2016/June/20160628_Press_Briefing.mp3","author":"the White House"},{"page_link":"https://obamawhitehouse.archives.gov/photos-and-video/video/2016/06/27/62716-white-house-press-briefing","title":"6/27/16: White House Press Briefing","published_date":"2016-06-27T00:00:00+00:00","content":"https://obamawhitehouse.archives.gov/videos/2016/June/20160627_Press_Briefing.mp3","author":"the White House"},{"page_link":"https://obamawhitehouse.archives.gov/photos-and-video/video/2016/06/23/president-obama-delivers-statement","title":"President Obama Delivers a Statement","published_date":"2016-06-23T00:00:00+00:00","content":"https://obamawhitehouse.archives.gov/videos/2016/June/20160623_POTUS_Delivers_Statement.mp3","author":"the White House"},{"page_link":"https://obamawhitehouse.archives.gov/photos-and-video/video/2016/06/15/61516-white-house-press-briefing","title":"6/15/16: White House Press Briefing","published_date":"2016-06-15T00:00:00+00:00","content":"https://obamawhitehouse.archives.gov/videos/2016/June/20160615_Press_Briefing.mp3","author":"the White House"},{"page_link":"https://obamawhitehouse.archives.gov/photos-and-video/video/2016/06/14/61316-white-house-press-briefing","title":"6/13/16: White House Press Briefing","published_date":"2016-06-14T00:00:00+00:00","content":"https://obamawhitehouse.archives.gov/videos/2016/June/20160614_Press_Briefing.mp3","author":"the White House"},{"page_link":"https://obamawhitehouse.archives.gov/photos-and-video/video/2016/06/13/61316-white-house-press-briefing-0","title":"6/13/16: White House Press Briefing","published_date":"2016-06-13T00:00:00+00:00","content":"https://obamawhitehouse.archives.gov/videos/2016/June/20160613_Press_Briefing.mp3","author":"the White House"},{"page_link":"https://obamawhitehouse.archives.gov/photos-and-video/video/2016/06/13/61316-white-house-press-briefing","title":"6/13/16: White House Press Briefing","published_date":"2016-06-13T00:00:00+00:00","content":"https://obamawhitehouse.archives.gov/videos/2016/June/20160613_Press_Briefing.mp3","author":"the White House"},{"page_link":"https://obamawhitehouse.archives.gov/photos-and-video/video/2016/06/10/61016-white-house-press-briefing","title":"6/10/16: White House Press Briefing","published_date":"2016-06-10T00:00:00+00:00","content":"https://obamawhitehouse.archives.gov/videos/2016/June/20160610_Press_Briefing.mp3","author":"the White House"},{"page_link":"https://obamawhitehouse.archives.gov/photos-and-video/video/2016/06/07/672016-press-briefing","title":"6/7/2016: Press Briefing","published_date":"2016-06-07T00:00:00+00:00","content":"https://obamawhitehouse.archives.gov/videos/2016/June/20160607_Press_Briefing.mp3","author":"the White House"},{"page_link":"https://obamawhitehouse.archives.gov/photos-and-video/video/2016/06/06/662016-press-briefing","title":"6/6/2016: Press Briefing","published_date":"2016-06-06T00:00:00+00:00","content":"https://obamawhitehouse.archives.gov/videos/2016/June/20160606_Press_Briefing.mp3","author":"the White House"},{"page_link":"https://obamawhitehouse.archives.gov/photos-and-video/video/2016/05/31/53116-white-house-press-briefing","title":"5/31/16: White House Press Briefing","published_date":"2016-05-31T00:00:00+00:00","content":"https://obamawhitehouse.archives.gov/videos/2016/May/20160531_Press_Briefing.mp3","author":"the White House"},{"page_link":"https://obamawhitehouse.archives.gov/photos-and-video/video/2016/05/24/52416-white-house-press-briefing","title":"5/24/16: White House Press Briefing","published_date":"2016-05-24T00:00:00+00:00","content":"https://obamawhitehouse.archives.gov/videos/2016/May/20160524_Press_Briefing.mp3","author":"the White House"},{"page_link":"https://obamawhitehouse.archives.gov/photos-and-video/video/2016/05/18/51816-white-house-press-briefing","title":"5/18/16: White House Press Briefing","published_date":"2016-05-18T00:00:00+00:00","content":"https://obamawhitehouse.archives.gov/videos/2016/May/20160518_Press_Briefing.mp3","author":"the White House"},{"page_link":"https://obamawhitehouse.archives.gov/photos-and-video/video/2016/05/17/51716-white-house-press-briefing","title":"5/17/16: White House Press Briefing","published_date":"2016-05-17T00:00:00+00:00","content":"https://obamawhitehouse.archives.gov/videos/2016/May/20160517_Press_Briefing.mp3","author":"the White House"},{"page_link":"https://obamawhitehouse.archives.gov/photos-and-video/video/2016/05/16/51616-white-house-press-briefing","title":"5/16/16: White House Press Briefing","published_date":"2016-05-16T00:00:00+00:00","content":"https://obamawhitehouse.archives.gov/videos/2016/May/20160516_Press_Briefing.mp3","author":"the White House"},{"page_link":"https://obamawhitehouse.archives.gov/photos-and-video/video/2016/05/12/51216-white-house-press-briefing","title":"5/12/16: White House Press Briefing","published_date":"2016-05-12T00:00:00+00:00","content":"https://obamawhitehouse.archives.gov/videos/2016/May/20160512_Press_Briefing.mp3","author":"the White House"},{"page_link":"https://obamawhitehouse.archives.gov/photos-and-video/video/2016/05/11/51116-white-house-press-briefing","title":"5/11/16: White House Press Briefing","published_date":"2016-05-11T00:00:00+00:00","content":"https://obamawhitehouse.archives.gov/videos/2016/May/20160511_Press_Briefing.mp3","author":"the White House"},{"page_link":"https://obamawhitehouse.archives.gov/photos-and-video/video/2016/05/10/51016-white-house-press-briefing","title":"5/10/16: White House Press Briefing","published_date":"2016-05-10T00:00:00+00:00","content":"https://obamawhitehouse.archives.gov/videos/2016/May/20160510_Press_Briefing.mp3","author":"the White House"},{"page_link":"https://obamawhitehouse.archives.gov/photos-and-video/video/2016/05/09/5916-white-house-press-briefing","title":"5/9/16: White House Press Briefing","published_date":"2016-05-09T00:00:00+00:00","content":"https://obamawhitehouse.archives.gov/videos/2016/May/20160509_Press_Briefing.mp3","author":"the White House"},{"page_link":"https://obamawhitehouse.archives.gov/photos-and-video/video/2016/05/06/5616-white-house-press-briefing","title":"5/6/16: White House Press Briefing","published_date":"2016-05-06T00:00:00+00:00","content":"https://obamawhitehouse.archives.gov/videos/2016/May/20160506_Press_Briefing.mp3","author":"the White House"},{"page_link":"https://obamawhitehouse.archives.gov/photos-and-video/video/2016/05/06/president-obama-delivers-statement-economy","title":"President Obama Delivers a Statement on the Economy","published_date":"2016-05-06T00:00:00+00:00","content":"https://obamawhitehouse.archives.gov/videos/2016/May/20160506_POTUS_Statement_on_the_Economy.mp3","author":"the White House"},{"page_link":"https://obamawhitehouse.archives.gov/photos-and-video/video/2016/05/05/5516-white-house-press-briefing","title":"5/5/16: White House Press Briefing","published_date":"2016-05-05T00:00:00+00:00","content":"https://obamawhitehouse.archives.gov/videos/2016/May/20160505_Press_Briefing.mp3","author":"the White House"},{"page_link":"https://obamawhitehouse.archives.gov/photos-and-video/video/2016/05/03/5316-white-house-press-briefing","title":"5/3/16: White House Press Briefing","published_date":"2016-05-03T00:00:00+00:00","content":"https://obamawhitehouse.archives.gov/videos/2016/May/20160503_Press_Briefing.mp3","author":"the White House"},{"page_link":"https://obamawhitehouse.archives.gov/photos-and-video/video/2016/05/02/5216-white-house-press-briefing","title":"5/2/16: White House Press Briefing","published_date":"2016-05-02T00:00:00+00:00","content":"https://obamawhitehouse.archives.gov/videos/2016/May/20160502_Press_Briefing.mp3","author":"the White House"},{"page_link":"https://obamawhitehouse.archives.gov/photos-and-video/video/2016/04/28/42816-white-house-press-briefing","title":"4/28/16: White House Press Briefing","published_date":"2016-04-28T00:00:00+00:00","content":"https://obamawhitehouse.archives.gov/videos/2016/April/20160428_Press_Briefing.mp3","author":"the White House"},{"page_link":"https://obamawhitehouse.archives.gov/photos-and-video/video/2016/04/27/042716-white-house-press-briefing","title":"04/27/16: White House Press Briefing","published_date":"2016-04-27T00:00:00+00:00","content":"https://obamawhitehouse.archives.gov/videos/2016/April/20160427_Press_Briefing.mp3","author":"the White House"},{"page_link":"https://obamawhitehouse.archives.gov/photos-and-video/video/2016/04/26/042616-white-house-press-briefing","title":"04/26/16: White House Press Briefing","published_date":"2016-04-26T00:00:00+00:00","content":"https://obamawhitehouse.archives.gov/videos/2016/April/20160426_Press_Briefing.mp3","author":"the White House"},{"page_link":"https://obamawhitehouse.archives.gov/photos-and-video/video/2016/04/21/press-briefing-press-secretary-josh-earnest","title":"Press Briefing by Press Secretary Josh Earnest","published_date":"2016-04-21T00:00:00+00:00","content":"https://obamawhitehouse.archives.gov/videos/2016/April/20160421_Press_Briefing.mp3","author":"the White House"},{"page_link":"https://obamawhitehouse.archives.gov/photos-and-video/video/2016/04/19/41916-white-house-press-briefing","title":"4/19/16: White House Press Briefing","published_date":"2016-04-19T00:00:00+00:00","content":"https://obamawhitehouse.archives.gov/videos/2016/April/20160419_Press_Briefing.mp3","author":"the White House"},{"page_link":"https://obamawhitehouse.archives.gov/photos-and-video/video/2016/04/18/41816-white-house-press-briefing","title":"4/18/16: White House Press Briefing","published_date":"2016-04-18T00:00:00+00:00","content":"https://obamawhitehouse.archives.gov/videos/2016/April/20160418_Press_Briefing.mp3","author":"the White House"},{"page_link":"https://obamawhitehouse.archives.gov/photos-and-video/video/2016/04/15/41516-white-house-press-briefing","title":"4/15/16: White House Press Briefing","published_date":"2016-04-15T00:00:00+00:00","content":"https://obamawhitehouse.archives.gov/videos/2016/April/20160415_Press_Briefing.mp3","author":"the White House"},{"page_link":"https://obamawhitehouse.archives.gov/photos-and-video/video/2016/04/14/41416-white-house-press-briefing","title":"4/14/16: White House Press Briefing","published_date":"2016-04-14T00:00:00+00:00","content":"https://obamawhitehouse.archives.gov/videos/2016/April/20160414_Press_Briefing.mp3","author":"the White House"},{"page_link":"https://obamawhitehouse.archives.gov/photos-and-video/video/2016/04/13/4132016-white-house-press-briefing","title":"4/13/2016: White House Press Briefing","published_date":"2016-04-13T00:00:00+00:00","content":"https://obamawhitehouse.archives.gov/videos/2016/April/20160413_Press_Briefing.mp3","author":"the White House"},{"page_link":"https://obamawhitehouse.archives.gov/photos-and-video/video/2016/04/12/4122016-white-house-press-briefing","title":"4/12/2016: White House Press Briefing","published_date":"2016-04-12T00:00:00+00:00","content":"https://obamawhitehouse.archives.gov/videos/2016/April/20160412_Press_Briefing.mp3","author":"the White House"},{"page_link":"https://obamawhitehouse.archives.gov/photos-and-video/video/2016/04/05/white-house-press-briefing","title":"White House Press Briefing   ","published_date":"2016-04-05T00:00:00+00:00","content":"https://obamawhitehouse.archives.gov/videos/2016/April/20160405_Press_Briefing.mp3","author":"the White House"},{"page_link":"https://obamawhitehouse.archives.gov/photos-and-video/video/2016/04/05/president-obama-delivers-statement-economy","title":"President Obama Delivers a Statement on The Economy","published_date":"2016-04-05T00:00:00+00:00","content":"https://obamawhitehouse.archives.gov/videos/2016/April/20160405_POTUS_Delivers_Statement_Economy.mp3","author":"the White House"},{"page_link":"https://obamawhitehouse.archives.gov/photos-and-video/video/2016/04/04/white-house-press-briefing","title":"White House Press Briefing ","published_date":"2016-04-04T00:00:00+00:00","content":"https://obamawhitehouse.archives.gov/videos/2016/April/20160404_Press_Briefing.mp3","author":"the White House"},{"page_link":"https://obamawhitehouse.archives.gov/photos-and-video/video/2016/03/21/press-briefing-havana-cuba","title":"Press Briefing in Havana, Cuba","published_date":"2016-03-21T00:00:00+00:00","content":"https://obamawhitehouse.archives.gov/videos/2016/March/briefings/032116.mp3","author":"the White House"},{"page_link":"https://obamawhitehouse.archives.gov/photos-and-video/video/2016/03/18/press-briefing","title":"Press Briefing","published_date":"2016-03-18T00:00:00+00:00","content":"https://obamawhitehouse.archives.gov/videos/2016/March/briefings/031816.mp3","author":"the White House"},{"page_link":"https://obamawhitehouse.archives.gov/photos-and-video/video/2016/03/17/press-briefing","title":"Press Briefing","published_date":"2016-03-17T00:00:00+00:00","content":"https://obamawhitehouse.archives.gov/videos/2016/March/briefings/031716.mp3","author":"the White House"},{"page_link":"https://obamawhitehouse.archives.gov/photos-and-video/video/2016/03/16/press-briefing","title":"Press Briefing","published_date":"2016-03-16T00:00:00+00:00","content":"https://obamawhitehouse.archives.gov/videos/2016/March/briefings/031616.mp3","author":"the White House"},{"page_link":"https://obamawhitehouse.archives.gov/photos-and-video/video/2016/03/15/press-briefing","title":"Press Briefing","published_date":"2016-03-15T00:00:00+00:00","content":"https://obamawhitehouse.archives.gov/videos/2016/March/briefings/031516.mp3","author":"the White House"},{"page_link":"https://obamawhitehouse.archives.gov/photos-and-video/video/2016/03/14/press-briefing","title":"Press Briefing","published_date":"2016-03-14T00:00:00+00:00","content":"https://obamawhitehouse.archives.gov/videos/2016/March/briefings/031416.mp3","author":"the White House"},{"page_link":"https://obamawhitehouse.archives.gov/photos-and-video/video/2016/03/09/press-briefing","title":"Press Briefing","published_date":"2016-03-09T00:00:00+00:00","content":"https://obamawhitehouse.archives.gov/videos/2016/March/briefings/030916.mp3","author":"the White House"},{"page_link":"https://obamawhitehouse.archives.gov/photos-and-video/video/2016/03/08/press-briefing","title":"Press Briefing","published_date":"2016-03-08T00:00:00+00:00","content":"https://obamawhitehouse.archives.gov/videos/2016/March/briefings/030816.mp3","author":"the White House"},{"page_link":"https://obamawhitehouse.archives.gov/photos-and-video/video/2016/03/07/press-briefing","title":"Press Briefing","published_date":"2016-03-07T00:00:00+00:00","content":"https://obamawhitehouse.archives.gov/videos/2016/March/briefings/030716.mp3","author":"the White House"},{"page_link":"https://obamawhitehouse.archives.gov/photos-and-video/video/2016/03/04/press-briefing","title":"Press Briefing","published_date":"2016-03-04T00:00:00+00:00","content":"https://obamawhitehouse.archives.gov/videos/2016/March/briefings/030416.mp3","author":"the White House"},{"page_link":"https://obamawhitehouse.archives.gov/photos-and-video/video/2016/03/02/press-briefing","title":"Press Briefing","published_date":"2016-03-02T00:00:00+00:00","content":"https://obamawhitehouse.archives.gov/videos/2016/March/briefings/030216.mp3","author":"the White House"},{"page_link":"https://obamawhitehouse.archives.gov/photos-and-video/video/2016/03/01/press-briefing","title":"Press Briefing","published_date":"2016-03-01T00:00:00+00:00","content":"https://obamawhitehouse.archives.gov/videos/2016/March/briefings/030116.mp3","author":"the White House"},{"page_link":"https://obamawhitehouse.archives.gov/photos-and-video/video/2016/02/29/press-briefing","title":"Press Briefing","published_date":"2016-02-29T00:00:00+00:00","content":"https://obamawhitehouse.archives.gov/videos/2016/February/briefings/022916.mp3","author":"the White House"},{"page_link":"https://obamawhitehouse.archives.gov/photos-and-video/video/2016/02/25/press-briefing","title":"Press Briefing","published_date":"2016-02-25T00:00:00+00:00","content":"https://obamawhitehouse.archives.gov/videos/2016/February/briefings/022516.mp3","author":"the White House"},{"page_link":"https://obamawhitehouse.archives.gov/photos-and-video/video/2016/02/24/press-briefing","title":"Press Briefing","published_date":"2016-02-24T00:00:00+00:00","content":"https://obamawhitehouse.archives.gov/videos/2016/February/briefings/022416.mp3","author":"the White House"},{"page_link":"https://obamawhitehouse.archives.gov/photos-and-video/video/2016/02/23/press-briefing-0","title":"Press Briefing","published_date":"2016-02-23T00:00:00+00:00","content":"https://obamawhitehouse.archives.gov/videos/2016/February/briefings/022316.mp3","author":"the White House"},{"page_link":"https://obamawhitehouse.archives.gov/photos-and-video/video/2016/02/22/press-briefing","title":"Press Briefing","published_date":"2016-02-22T00:00:00+00:00","content":"https://obamawhitehouse.archives.gov/videos/2016/February/briefings/022216.mp3","author":"the White House"},{"page_link":"https://obamawhitehouse.archives.gov/photos-and-video/video/2016/02/19/press-briefing","title":"Press Briefing","published_date":"2016-02-19T00:00:00+00:00","content":"https://obamawhitehouse.archives.gov/videos/2016/February/briefings/021916.mp3","author":"the White House"},{"page_link":"https://obamawhitehouse.archives.gov/photos-and-video/video/2016/02/18/press-briefing","title":"Press Briefing","published_date":"2016-02-18T00:00:00+00:00","content":"https://obamawhitehouse.archives.gov/videos/2016/February/briefings/021816.mp3","author":"the White House"},{"page_link":"https://obamawhitehouse.archives.gov/photos-and-video/video/2016/02/17/press-briefing","title":"Press Briefing","published_date":"2016-02-17T00:00:00+00:00","content":"https://obamawhitehouse.archives.gov/videos/2016/February/briefings/021716.mp3","author":"the White House"},{"page_link":"https://obamawhitehouse.archives.gov/photos-and-video/video/2016/02/15/21516-white-house-press-briefing-sunnylands","title":"2/15/16: White House Press Briefing in Sunnylands","published_date":"2016-02-15T00:00:00+00:00","content":"https://obamawhitehouse.archives.gov/videos/2016/February/briefings/021516.mp3","author":"the White House"},{"page_link":"https://obamawhitehouse.archives.gov/photos-and-video/video/2016/02/09/senior-administration-officials-discuss-presidents-fy2017-budget","title":"Senior Administration Officials Discuss the President's FY2017 Budget","published_date":"2016-02-09T00:00:00+00:00","content":"https://obamawhitehouse.archives.gov/videos/2016/February/020916_FY2017_Budget.mp3","author":"the White House"},{"page_link":"https://obamawhitehouse.archives.gov/photos-and-video/video/2016/02/08/press-briefing","title":"Press Briefing","published_date":"2016-02-08T00:00:00+00:00","content":"https://obamawhitehouse.archives.gov/videos/2016/February/briefings/020816.mp3","author":"the White House"},{"page_link":"https://obamawhitehouse.archives.gov/photos-and-video/video/2016/02/05/press-briefing","title":"Press Briefing","published_date":"2016-02-05T00:00:00+00:00","content":"https://obamawhitehouse.archives.gov/videos/2016/February/briefings/020516.mp3","author":"the White House"},{"page_link":"https://obamawhitehouse.archives.gov/photos-and-video/video/2016/02/04/press-brieifng","title":"Press Brieifng","published_date":"2016-02-04T00:00:00+00:00","content":"https://obamawhitehouse.archives.gov/videos/2016/February/briefings/020416.mp3","author":"the White House"},{"page_link":"https://obamawhitehouse.archives.gov/photos-and-video/video/2016/02/02/press-briefing","title":"Press Briefing","published_date":"2016-02-02T00:00:00+00:00","content":"https://obamawhitehouse.archives.gov/videos/2016/February/briefings/020216.mp3","author":"the White House"},{"page_link":"https://obamawhitehouse.archives.gov/photos-and-video/video/2016/02/01/press-briefing","title":"Press Briefing","published_date":"2016-02-01T00:00:00+00:00","content":"https://obamawhitehouse.archives.gov/videos/2016/February/briefings/020116.mp3","author":"the White House"},{"page_link":"https://obamawhitehouse.archives.gov/photos-and-video/video/2016/01/29/press-briefing","title":"Press Briefing","published_date":"2016-01-29T00:00:00+00:00","content":"https://obamawhitehouse.archives.gov/videos/2016/January/briefings/012916.mp3","author":"the White House"},{"page_link":"https://obamawhitehouse.archives.gov/photos-and-video/video/2016/01/28/press-briefing","title":"Press Briefing","published_date":"2016-01-28T00:00:00+00:00","content":"https://obamawhitehouse.archives.gov/videos/2016/January/briefings/012816.mp3","author":"the White House"},{"page_link":"https://obamawhitehouse.archives.gov/photos-and-video/video/2016/01/27/press-briefing","title":"Press Briefing","published_date":"2016-01-27T00:00:00+00:00","content":"https://obamawhitehouse.archives.gov/videos/2016/January/briefings/012716.mp3","author":"the White House"},{"page_link":"https://obamawhitehouse.archives.gov/photos-and-video/video/2016/01/21/press-briefing","title":"Press Briefing","published_date":"2016-01-21T00:00:00+00:00","content":"https://obamawhitehouse.archives.gov/videos/2016/January/briefings/012116.mp3","author":"the White House"},{"page_link":"https://obamawhitehouse.archives.gov/photos-and-video/video/2016/01/19/press-briefing","title":"Press Briefing","published_date":"2016-01-19T00:00:00+00:00","content":"https://obamawhitehouse.archives.gov/videos/2016/January/briefings/011916.mp3","author":"the White House"},{"page_link":"https://obamawhitehouse.archives.gov/photos-and-video/video/2016/01/11/press-briefing","title":"Press Briefing","published_date":"2016-01-11T00:00:00+00:00","content":"https://obamawhitehouse.archives.gov/videos/2016/January/briefings/011116.mp3","author":"the White House"},{"page_link":"https://obamawhitehouse.archives.gov/photos-and-video/video/2016/01/08/press-briefing","title":"Press Briefing","published_date":"2016-01-08T00:00:00+00:00","content":"https://obamawhitehouse.archives.gov/videos/2016/January/briefings/010816.mp3","author":"the White House"},{"page_link":"https://obamawhitehouse.archives.gov/photos-and-video/video/2016/01/07/press-briefing","title":"Press Briefing","published_date":"2016-01-07T00:00:00+00:00","content":"https://obamawhitehouse.archives.gov/videos/2016/January/briefings/010716.mp3","author":"the White House"},{"page_link":"https://obamawhitehouse.archives.gov/photos-and-video/video/2016/01/06/press-briefing","title":"Press Briefing","published_date":"2016-01-06T00:00:00+00:00","content":"https://obamawhitehouse.archives.gov/videos/2016/January/briefings/010616.mp3","author":"the White House"},{"page_link":"https://obamawhitehouse.archives.gov/photos-and-video/video/2016/01/05/press-briefing","title":"Press Briefing","published_date":"2016-01-05T00:00:00+00:00","content":"https://obamawhitehouse.archives.gov/videos/2016/January/briefings/010516.mp3","author":"the White House"},{"page_link":"https://obamawhitehouse.archives.gov/photos-and-video/video/2016/01/04/press-briefings","title":"Press Briefings","published_date":"2016-01-04T00:00:00+00:00","content":"https://obamawhitehouse.archives.gov/videos/2016/January/briefings/010416.mp3","author":"the White House"},{"page_link":"https://obamawhitehouse.archives.gov/photos-and-video/video/2015/12/17/press-briefing","title":"Press Briefing","published_date":"2015-12-17T00:00:00+00:00","content":"https://obamawhitehouse.archives.gov/videos/2015/December/briefings/121715.mp3","author":"the White House"},{"page_link":"https://obamawhitehouse.archives.gov/photos-and-video/video/2015/12/16/press-briefing","title":"Press Briefing","published_date":"2015-12-16T00:00:00+00:00","content":"https://obamawhitehouse.archives.gov/videos/2015/December/briefings/121515.mp3","author":"the White House"},{"page_link":"https://obamawhitehouse.archives.gov/photos-and-video/video/2015/12/15/press-briefing","title":"Press Briefing","published_date":"2015-12-15T00:00:00+00:00","content":"https://obamawhitehouse.archives.gov/videos/2015/December/briefings/121515.mp3","author":"the White House"},{"page_link":"https://obamawhitehouse.archives.gov/photos-and-video/video/2015/12/14/press-briefing","title":"Press Briefing","published_date":"2015-12-14T00:00:00+00:00","content":"https://obamawhitehouse.archives.gov/videos/2015/December/briefings/121415.mp3","author":"the White House"},{"page_link":"https://obamawhitehouse.archives.gov/photos-and-video/video/2015/12/11/press-briefing","title":"Press Briefing","published_date":"2015-12-11T00:00:00+00:00","content":"https://obamawhitehouse.archives.gov/videos/2015/December/briefings/121115.mp3","author":"the White House"},{"page_link":"https://obamawhitehouse.archives.gov/photos-and-video/video/2015/12/10/press-briefing","title":"Press Briefing","published_date":"2015-12-10T00:00:00+00:00","content":"https://obamawhitehouse.archives.gov/videos/2015/December/briefings/121015.mp3","author":"the White House"},{"page_link":"https://obamawhitehouse.archives.gov/photos-and-video/video/2015/12/09/press-briefing-0","title":"Press Briefing","published_date":"2015-12-09T00:00:00+00:00","content":"https://obamawhitehouse.archives.gov/videos/2015/December/briefings/120915.mp3","author":"the White House"},{"page_link":"https://obamawhitehouse.archives.gov/photos-and-video/video/2015/12/09/press-briefing","title":"Press Briefing","published_date":"2015-12-09T00:00:00+00:00","content":"https://obamawhitehouse.archives.gov/videos/2015/December/briefings/120815.mp3","author":"the White House"},{"page_link":"https://obamawhitehouse.archives.gov/photos-and-video/video/2015/12/07/press-briefing","title":"Press Briefing","published_date":"2015-12-07T00:00:00+00:00","content":"https://obamawhitehouse.archives.gov/videos/2015/December/briefings/120715.mp3","author":"the White House"},{"page_link":"https://obamawhitehouse.archives.gov/photos-and-video/video/2015/12/04/press-briefing","title":"Press Briefing","published_date":"2015-12-04T00:00:00+00:00","content":"https://obamawhitehouse.archives.gov/videos/2015/December/briefings/120415.mp3","author":"the White House"},{"page_link":"https://obamawhitehouse.archives.gov/photos-and-video/video/2015/12/03/press-briefing","title":"Press Briefing","published_date":"2015-12-03T00:00:00+00:00","content":"https://obamawhitehouse.archives.gov/videos/2015/December/briefings/120315.mp3","author":"the White House"},{"page_link":"https://obamawhitehouse.archives.gov/photos-and-video/video/2015/12/02/press-briefing","title":"Press Briefing","published_date":"2015-12-02T00:00:00+00:00","content":"https://obamawhitehouse.archives.gov/videos/2015/December/briefings/120215.mp3","author":"the White House"},{"page_link":"https://obamawhitehouse.archives.gov/photos-and-video/video/2015/11/30/press-briefing","title":"Press Briefing","published_date":"2015-11-30T00:00:00+00:00","content":"https://obamawhitehouse.archives.gov/videos/2015/November/briefings/113015.mp3","author":"the White House"},{"page_link":"https://obamawhitehouse.archives.gov/photos-and-video/video/2015/11/23/press-briefing","title":"Press Briefing","published_date":"2015-11-23T00:00:00+00:00","content":"https://obamawhitehouse.archives.gov/videos/2015/November/briefings/112315.mp3","author":"the White House"},{"page_link":"https://obamawhitehouse.archives.gov/photos-and-video/video/2015/11/19/press-briefing-ambassador-froman-ben-rhodes-and-dan-kritenbrink","title":"Press Briefing with Ambassador Froman, Ben Rhodes, and Dan Kritenbrink","published_date":"2015-11-19T00:00:00+00:00","content":"https://obamawhitehouse.archives.gov/videos/2015/November/briefings/111915.mp3","author":"the White House"},{"page_link":"https://obamawhitehouse.archives.gov/photos-and-video/video/2015/11/13/press-briefing","title":"Press Briefing","published_date":"2015-11-13T00:00:00+00:00","content":"https://obamawhitehouse.archives.gov/videos/2015/November/briefings/111315.mp3","author":"the White House"},{"page_link":"https://obamawhitehouse.archives.gov/photos-and-video/video/2015/11/12/press-briefing","title":"Press Briefing","published_date":"2015-11-12T00:00:00+00:00","content":"https://obamawhitehouse.archives.gov/videos/2015/November/briefings/111215.mp3","author":"the White House"},{"page_link":"https://obamawhitehouse.archives.gov/photos-and-video/video/2015/11/10/press-briefing","title":"Press Briefing","published_date":"2015-11-10T00:00:00+00:00","content":"https://obamawhitehouse.archives.gov/videos/2015/November/briefings/111015.mp3","author":"the White House"},{"page_link":"https://obamawhitehouse.archives.gov/photos-and-video/video/2015/11/09/press-briefing","title":"Press Briefing","published_date":"2015-11-09T00:00:00+00:00","content":"https://obamawhitehouse.archives.gov/videos/2015/November/briefings/110915.mp3","author":"the White House"},{"page_link":"https://obamawhitehouse.archives.gov/photos-and-video/video/2015/11/06/press-briefing","title":"Press Briefing","published_date":"2015-11-06T00:00:00+00:00","content":"https://obamawhitehouse.archives.gov/videos/2015/November/briefings/110615.mp3","author":"the White House"},{"page_link":"https://obamawhitehouse.archives.gov/photos-and-video/video/2015/11/05/press-briefing","title":"Press Briefing","published_date":"2015-11-05T00:00:00+00:00","content":"https://obamawhitehouse.archives.gov/videos/2015/November/briefings/110515.mp3","author":"the White House"},{"page_link":"https://obamawhitehouse.archives.gov/photos-and-video/video/2015/11/04/press-briefing","title":"Press Briefing","published_date":"2015-11-04T00:00:00+00:00","content":"https://obamawhitehouse.archives.gov/videos/2015/November/briefings/110415.mp3","author":"the White House"},{"page_link":"https://obamawhitehouse.archives.gov/photos-and-video/video/2015/11/03/press-briefing","title":"Press Briefing","published_date":"2015-11-03T00:00:00+00:00","content":"https://obamawhitehouse.archives.gov/videos/2015/November/briefings/110315.mp3","author":"the White House"},{"page_link":"https://obamawhitehouse.archives.gov/photos-and-video/video/2015/10/30/press-briefing","title":"Press Briefing","published_date":"2015-10-30T00:00:00+00:00","content":"https://obamawhitehouse.archives.gov/videos/2015/October/briefings/103015.mp3","author":"the White House"},{"page_link":"https://obamawhitehouse.archives.gov/photos-and-video/video/2015/10/29/press-briefing","title":"Press Briefing","published_date":"2015-10-29T00:00:00+00:00","content":"https://obamawhitehouse.archives.gov/videos/2015/October/briefings/102915.mp3","author":"the White House"},{"page_link":"https://obamawhitehouse.archives.gov/photos-and-video/video/2015/10/26/press-briefing","title":"Press Briefing","published_date":"2015-10-26T00:00:00+00:00","content":"https://obamawhitehouse.archives.gov/videos/2015/October/briefings/102615.mp3","author":"the White House"},{"page_link":"https://obamawhitehouse.archives.gov/photos-and-video/video/2015/10/23/press-briefing","title":"Press Briefing","published_date":"2015-10-23T00:00:00+00:00","content":"https://obamawhitehouse.archives.gov/videos/2015/October/briefings/102315.mp3","author":"the White House"},{"page_link":"https://obamawhitehouse.archives.gov/photos-and-video/video/2015/10/22/press-briefings","title":"Press Briefings","published_date":"2015-10-22T00:00:00+00:00","content":"https://obamawhitehouse.archives.gov/videos/2015/October/briefings/102215.mp3","author":"the White House"},{"page_link":"https://obamawhitehouse.archives.gov/photos-and-video/video/2015/10/20/press-briefing","title":"Press Briefing","published_date":"2015-10-20T00:00:00+00:00","content":"https://obamawhitehouse.archives.gov/videos/2015/October/briefings/102015.mp3","author":"the White House"},{"page_link":"https://obamawhitehouse.archives.gov/photos-and-video/video/2015/10/19/press-briefing","title":"Press Briefing","published_date":"2015-10-19T00:00:00+00:00","content":"https://obamawhitehouse.archives.gov/videos/2015/October/briefings/101915.mp3","author":"the White House"},{"page_link":"https://obamawhitehouse.archives.gov/photos-and-video/video/2015/10/15/press-briefing","title":"Press Briefing","published_date":"2015-10-15T00:00:00+00:00","content":"https://obamawhitehouse.archives.gov/videos/2015/October/briefings/101515.mp3","author":"the White House"},{"page_link":"https://obamawhitehouse.archives.gov/photos-and-video/video/2015/10/14/press-briefing","title":"Press Briefing","published_date":"2015-10-14T00:00:00+00:00","content":"https://obamawhitehouse.archives.gov/videos/2015/October/briefings/101415.mp3","author":"the White House"},{"page_link":"https://obamawhitehouse.archives.gov/photos-and-video/video/2015/10/13/press-briefing","title":"Press Briefing","published_date":"2015-10-13T00:00:00+00:00","content":"https://obamawhitehouse.archives.gov/videos/2015/October/briefings/101315.mp3","author":"the White House"},{"page_link":"https://obamawhitehouse.archives.gov/photos-and-video/video/2015/10/08/press-briefing","title":"Press Briefing","published_date":"2015-10-08T00:00:00+00:00","content":"https://obamawhitehouse.archives.gov/videos/2015/October/briefings/100815.mp3","author":"the White House"},{"page_link":"https://obamawhitehouse.archives.gov/photos-and-video/video/2015/10/07/press-briefing","title":"Press Briefing","published_date":"2015-10-07T00:00:00+00:00","content":"https://obamawhitehouse.archives.gov/videos/2015/October/briefings/100715.mp3","author":"the White House"},{"page_link":"https://obamawhitehouse.archives.gov/photos-and-video/video/2015/10/06/press-briefing","title":"Press Briefing","published_date":"2015-10-06T00:00:00+00:00","content":"https://obamawhitehouse.archives.gov/videos/2015/October/briefings/100615.mp3","author":"the White House"},{"page_link":"https://obamawhitehouse.archives.gov/photos-and-video/video/2015/10/05/press-briefing","title":"Press Briefing","published_date":"2015-10-05T00:00:00+00:00","content":"https://obamawhitehouse.archives.gov/videos/2015/October/briefings/100515.mp3","author":"the White House"},{"page_link":"https://obamawhitehouse.archives.gov/photos-and-video/video/2015/10/01/press-briefing","title":"Press Briefing","published_date":"2015-10-01T00:00:00+00:00","content":"https://obamawhitehouse.archives.gov/videos/2015/October/briefings/100115.mp3","author":"the White House"},{"page_link":"https://obamawhitehouse.archives.gov/photos-and-video/video/2015/09/30/press-briefing","title":"Press Briefing","published_date":"2015-09-30T00:00:00+00:00","content":"https://obamawhitehouse.archives.gov/videos/2015/September/briefings/093015.mp3","author":"the White House"},{"page_link":"https://obamawhitehouse.archives.gov/photos-and-video/video/2015/09/24/press-briefing","title":"Press Briefing","published_date":"2015-09-24T00:00:00+00:00","content":"https://obamawhitehouse.archives.gov/videos/2015/September/briefings/092415.mp3","author":"the White House"},{"page_link":"https://obamawhitehouse.archives.gov/photos-and-video/video/2015/09/23/press-briefing","title":"Press Briefing","published_date":"2015-09-23T00:00:00+00:00","content":"https://obamawhitehouse.archives.gov/videos/2015/September/briefings/092315.mp3","author":"the White House"},{"page_link":"https://obamawhitehouse.archives.gov/photos-and-video/video/2015/09/22/press-briefing","title":"Press Briefing ","published_date":"2015-09-22T00:00:00+00:00","content":"https://obamawhitehouse.archives.gov/videos/2015/September/briefings/092215.mp3","author":"the White House"},{"page_link":"https://obamawhitehouse.archives.gov/photos-and-video/video/2015/09/21/press-briefing","title":"Press Briefing","published_date":"2015-09-21T00:00:00+00:00","content":"https://obamawhitehouse.archives.gov/videos/2015/September/briefings/092115.mp3","author":"the White House"},{"page_link":"https://obamawhitehouse.archives.gov/photos-and-video/video/2015/09/18/press-briefing","title":"Press Briefing","published_date":"2015-09-18T00:00:00+00:00","content":"https://obamawhitehouse.archives.gov/videos/2015/September/briefings/091815.mp3","author":"the White House"},{"page_link":"https://obamawhitehouse.archives.gov/photos-and-video/video/2015/09/17/press-briefing","title":"Press Briefing","published_date":"2015-09-17T00:00:00+00:00","content":"https://obamawhitehouse.archives.gov/videos/2015/September/briefings/091715.mp3","author":"the White House"},{"page_link":"https://obamawhitehouse.archives.gov/photos-and-video/video/2015/09/16/press-briefing","title":"Press Briefing","published_date":"2015-09-16T00:00:00+00:00","content":"https://obamawhitehouse.archives.gov/videos/2015/September/briefings/091615.mp3","author":"the White House"},{"page_link":"https://obamawhitehouse.archives.gov/photos-and-video/video/2015/09/15/press-briefing","title":"Press Briefing","published_date":"2015-09-15T00:00:00+00:00","content":"https://obamawhitehouse.archives.gov/videos/2015/September/briefings/091515.mp3","author":"the White House"},{"page_link":"https://obamawhitehouse.archives.gov/photos-and-video/video/2015/09/11/press-briefing","title":"Press Briefing","published_date":"2015-09-11T00:00:00+00:00","content":"https://obamawhitehouse.archives.gov/videos/2015/September/briefings/091115.mp3","author":"the White House"},{"page_link":"https://obamawhitehouse.archives.gov/photos-and-video/video/2015/09/10/press-briefing","title":"Press Briefing","published_date":"2015-09-10T00:00:00+00:00","content":"https://obamawhitehouse.archives.gov/videos/2015/September/briefings/091015.mp3","author":"the White House"},{"page_link":"https://obamawhitehouse.archives.gov/photos-and-video/video/2015/09/08/press-briefing","title":"Press Briefing","published_date":"2015-09-08T00:00:00+00:00","content":"https://obamawhitehouse.archives.gov/videos/2015/September/briefings/090815.mp3","author":"the White House"},{"page_link":"https://obamawhitehouse.archives.gov/photos-and-video/video/2015/09/03/press-briefing","title":"Press Briefing","published_date":"2015-09-03T00:00:00+00:00","content":"https://obamawhitehouse.archives.gov/videos/2015/September/briefings/090315.mp3","author":"the White House"},{"page_link":"https://obamawhitehouse.archives.gov/photos-and-video/video/2015/08/28/press-briefing","title":"Press Briefing","published_date":"2015-08-28T00:00:00+00:00","content":"https://obamawhitehouse.archives.gov/videos/2015/August/briefings/082815.mp3","author":"the White House"},{"page_link":"https://obamawhitehouse.archives.gov/photos-and-video/video/2015/08/26/press-briefing","title":"Press Briefing","published_date":"2015-08-26T00:00:00+00:00","content":"https://obamawhitehouse.archives.gov/videos/2015/August/briefings/082615.mp3","author":"the White House"},{"page_link":"https://obamawhitehouse.archives.gov/photos-and-video/video/2015/08/24/press-briefing","title":"Press Briefing","published_date":"2015-08-24T00:00:00+00:00","content":"https://obamawhitehouse.archives.gov/videos/2015/August/briefings/082415.mp3","author":"the White House"},{"page_link":"https://obamawhitehouse.archives.gov/photos-and-video/video/2015/08/07/press-briefing","title":"Press Briefing","published_date":"2015-08-07T00:00:00+00:00","content":"https://obamawhitehouse.archives.gov/videos/2015/August/briefings/080715.mp3","author":"the White House"},{"page_link":"https://obamawhitehouse.archives.gov/photos-and-video/video/2015/08/06/press-briefing","title":"Press Briefing","published_date":"2015-08-06T00:00:00+00:00","content":"https://obamawhitehouse.archives.gov/videos/2015/August/briefings/080615.mp3","author":"the White House"},{"page_link":"https://obamawhitehouse.archives.gov/photos-and-video/video/2015/08/04/press-briefing","title":"Press Briefing","published_date":"2015-08-04T00:00:00+00:00","content":"https://obamawhitehouse.archives.gov/videos/2015/August/briefings/080415.mp3","author":"the White House"},{"page_link":"https://obamawhitehouse.archives.gov/photos-and-video/video/2015/08/03/press-briefing","title":"Press Briefing","published_date":"2015-08-03T00:00:00+00:00","content":"https://obamawhitehouse.archives.gov/videos/2015/August/briefings/080315.mp3","author":"the White House"},{"page_link":"https://obamawhitehouse.archives.gov/photos-and-video/video/2015/07/31/press-briefing","title":"Press Briefing","published_date":"2015-07-31T00:00:00+00:00","content":"https://obamawhitehouse.archives.gov/videos/2015/July/briefings/073115.mp3","author":"the White House"},{"page_link":"https://obamawhitehouse.archives.gov/photos-and-video/video/2015/07/30/press-briefing","title":"Press Briefing","published_date":"2015-07-30T00:00:00+00:00","content":"https://obamawhitehouse.archives.gov/videos/2015/July/briefings/073015.mp3","author":"the White House"},{"page_link":"https://obamawhitehouse.archives.gov/photos-and-video/video/2015/07/29/white-house-press-briefing-deputy-press-secretary-eric-schultz","title":"White House Press Briefing by Deputy Press Secretary Eric Schultz","published_date":"2015-07-29T00:00:00+00:00","content":"https://obamawhitehouse.archives.gov/videos/2015/July/briefings/072915.mp3","author":"the White House"},{"page_link":"https://obamawhitehouse.archives.gov/photos-and-video/video/2015/07/26/press-briefing","title":"Press Briefing","published_date":"2015-07-26T00:00:00+00:00","content":"https://obamawhitehouse.archives.gov/videos/2015/July/briefings/072615.mp3","author":"the White House"},{"page_link":"https://obamawhitehouse.archives.gov/photos-and-video/video/2015/07/23/press-briefing","title":"Press Briefing","published_date":"2015-07-23T00:00:00+00:00","content":"https://obamawhitehouse.archives.gov/videos/2015/July/briefings/072315.mp3","author":"the White House"},{"page_link":"https://obamawhitehouse.archives.gov/photos-and-video/video/2015/07/22/press-briefing","title":"Press Briefing","published_date":"2015-07-22T00:00:00+00:00","content":"https://obamawhitehouse.archives.gov/videos/2015/July/briefings/072215.mp3","author":"the White House"},{"page_link":"https://obamawhitehouse.archives.gov/photos-and-video/video/2015/07/20/press-briefing","title":"Press Briefing","published_date":"2015-07-20T00:00:00+00:00","content":"https://obamawhitehouse.archives.gov/videos/2015/July/briefings/072015.mp3","author":"the White House"},{"page_link":"https://obamawhitehouse.archives.gov/photos-and-video/video/2015/07/17/press-briefing","title":"Press Briefing","published_date":"2015-07-17T00:00:00+00:00","content":"https://obamawhitehouse.archives.gov/videos/2015/July/briefings/071715.mp3","author":"the White House"},{"page_link":"https://obamawhitehouse.archives.gov/photos-and-video/video/2015/07/13/press-briefing","title":"Press Briefing","published_date":"2015-07-13T00:00:00+00:00","content":"https://obamawhitehouse.archives.gov/videos/2015/July/briefings/071315.mp3","author":"the White House"},{"page_link":"https://obamawhitehouse.archives.gov/photos-and-video/video/2015/07/10/press-briefing","title":"Press Briefing","published_date":"2015-07-10T00:00:00+00:00","content":"https://obamawhitehouse.archives.gov/videos/2015/July/briefings/071015.mp3","author":"the White House"},{"page_link":"https://obamawhitehouse.archives.gov/photos-and-video/video/2015/07/09/press-briefing","title":"Press Briefing","published_date":"2015-07-09T00:00:00+00:00","content":"https://obamawhitehouse.archives.gov/videos/2015/July/briefings/070915.mp3","author":"the White House"},{"page_link":"https://obamawhitehouse.archives.gov/photos-and-video/video/2015/07/08/press-briefing","title":"Press Briefing","published_date":"2015-07-08T00:00:00+00:00","content":"https://obamawhitehouse.archives.gov/videos/2015/July/briefings/070815.mp3","author":"the White House"},{"page_link":"https://obamawhitehouse.archives.gov/photos-and-video/video/2015/07/07/press-briefing","title":"Press Briefing","published_date":"2015-07-07T00:00:00+00:00","content":"https://obamawhitehouse.archives.gov/videos/2015/July/briefings/070715.mp3","author":"the White House"},{"page_link":"https://obamawhitehouse.archives.gov/photos-and-video/video/2015/07/06/press-briefing","title":"Press Briefing","published_date":"2015-07-06T00:00:00+00:00","content":"https://obamawhitehouse.archives.gov/videos/2015/July/briefings/070615.mp3","author":"the White House"},{"page_link":"https://obamawhitehouse.archives.gov/photos-and-video/video/2015/06/29/press-briefing","title":"Press Briefing","published_date":"2015-06-29T00:00:00+00:00","content":"https://obamawhitehouse.archives.gov/videos/2015/June/briefings/062915.mp3","author":"the White House"},{"page_link":"https://obamawhitehouse.archives.gov/photos-and-video/video/2015/06/25/press-briefing","title":"Press Briefing","published_date":"2015-06-25T00:00:00+00:00","content":"https://obamawhitehouse.archives.gov/videos/2015/June/briefings/062515.mp3","author":"the White House"},{"page_link":"https://obamawhitehouse.archives.gov/photos-and-video/video/2015/06/24/press-briefing","title":"Press Briefing","published_date":"2015-06-24T00:00:00+00:00","content":"https://obamawhitehouse.archives.gov/videos/2015/June/briefings/062415.mp3","author":"the White House"},{"page_link":"https://obamawhitehouse.archives.gov/photos-and-video/video/2015/06/23/press-briefing","title":"Press Briefing","published_date":"2015-06-23T00:00:00+00:00","content":"https://obamawhitehouse.archives.gov/videos/2015/June/briefings/062315.mp3","author":"the White House"},{"page_link":"https://obamawhitehouse.archives.gov/photos-and-video/video/2015/06/22/press-briefing","title":"Press Briefing","published_date":"2015-06-22T00:00:00+00:00","content":"https://obamawhitehouse.archives.gov/videos/2015/June/briefings/062215.mp3","author":"the White House"},{"page_link":"https://obamawhitehouse.archives.gov/photos-and-video/video/2015/06/17/press-briefing","title":"Press Briefing","published_date":"2015-06-17T00:00:00+00:00","content":"https://obamawhitehouse.archives.gov/videos/2015/June/briefings/061715.mp3","author":"the White House"},{"page_link":"https://obamawhitehouse.archives.gov/photos-and-video/video/2015/06/16/press-briefing","title":"Press Briefing","published_date":"2015-06-16T00:00:00+00:00","content":"https://obamawhitehouse.archives.gov/videos/2015/June/briefings/061615.mp3","author":"the White House"},{"page_link":"https://obamawhitehouse.archives.gov/photos-and-video/video/2015/06/15/press-briefing","title":"Press Briefing","published_date":"2015-06-15T00:00:00+00:00","content":"https://obamawhitehouse.archives.gov/videos/2015/June/briefings/061515.mp3","author":"the White House"},{"page_link":"https://obamawhitehouse.archives.gov/photos-and-video/video/2015/06/12/press-briefing","title":"Press Briefing","published_date":"2015-06-12T00:00:00+00:00","content":"https://obamawhitehouse.archives.gov/videos/2015/June/briefings/061215.mp3","author":"the White House"},{"page_link":"https://obamawhitehouse.archives.gov/photos-and-video/video/2015/06/11/press-briefing","title":"Press Briefing","published_date":"2015-06-11T00:00:00+00:00","content":"https://obamawhitehouse.archives.gov/videos/2015/June/briefings/061115.mp3","author":"the White House"},{"page_link":"https://obamawhitehouse.archives.gov/photos-and-video/video/2015/06/10/press-briefing","title":"Press Briefing","published_date":"2015-06-10T00:00:00+00:00","content":"https://obamawhitehouse.archives.gov/videos/2015/June/briefings/061015.mp3","author":"the White House"},{"page_link":"https://obamawhitehouse.archives.gov/photos-and-video/video/2015/06/09/press-briefing","title":"Press Briefing","published_date":"2015-06-09T00:00:00+00:00","content":"https://obamawhitehouse.archives.gov/videos/2015/June/briefings/060915.mp3","author":"the White House"},{"page_link":"https://obamawhitehouse.archives.gov/photos-and-video/video/2015/06/07/press-briefing","title":"Press Briefing","published_date":"2015-06-07T00:00:00+00:00","content":"https://obamawhitehouse.archives.gov/videos/2015/June/briefings/060715.mp3","author":"the White House"},{"page_link":"https://obamawhitehouse.archives.gov/photos-and-video/video/2015/06/05/press-briefings","title":"Press Briefings","published_date":"2015-06-05T00:00:00+00:00","content":"https://obamawhitehouse.archives.gov/videos/2015/June/briefings/060515.mp3","author":"the White House"},{"page_link":"https://obamawhitehouse.archives.gov/photos-and-video/video/2015/06/04/press-briefings","title":"Press Briefings","published_date":"2015-06-04T00:00:00+00:00","content":"https://obamawhitehouse.archives.gov/videos/2015/June/briefings/060415.mp3","author":"the White House"},{"page_link":"https://obamawhitehouse.archives.gov/photos-and-video/video/2015/06/03/press-briefing","title":"Press Briefing","published_date":"2015-06-03T00:00:00+00:00","content":"https://obamawhitehouse.archives.gov/videos/2015/June/briefings/060315.mp3","author":"the White House"},{"page_link":"https://obamawhitehouse.archives.gov/photos-and-video/video/2015/06/02/press-briefing","title":"Press Briefing","published_date":"2015-06-02T00:00:00+00:00","content":"https://obamawhitehouse.archives.gov/videos/2015/June/briefings/060215.mp3","author":"the White House"},{"page_link":"https://obamawhitehouse.archives.gov/photos-and-video/video/2015/06/01/press-briefing","title":"Press Briefing","published_date":"2015-06-01T00:00:00+00:00","content":"https://obamawhitehouse.archives.gov/videos/2015/June/briefings/060115.mp3","author":"the White House"},{"page_link":"https://obamawhitehouse.archives.gov/photos-and-video/video/2015/05/29/press-briefing","title":"Press Briefing","published_date":"2015-05-29T00:00:00+00:00","content":"https://obamawhitehouse.archives.gov/videos/2015/May/briefings/052915.mp3","author":"the White House"},{"page_link":"https://obamawhitehouse.archives.gov/photos-and-video/video/2015/05/26/press-briefing","title":"Press Briefing","published_date":"2015-05-26T00:00:00+00:00","content":"https://obamawhitehouse.archives.gov/videos/2015/May/briefings/052615.mp3","author":"the White House"},{"page_link":"https://obamawhitehouse.archives.gov/photos-and-video/video/2015/05/22/press-briefing","title":"Press Briefing","published_date":"2015-05-22T00:00:00+00:00","content":"https://obamawhitehouse.archives.gov/videos/2015/May/briefings/052215.mp3","author":"the White House"},{"page_link":"https://obamawhitehouse.archives.gov/photos-and-video/video/2015/05/21/press-briefing","title":"Press Briefing","published_date":"2015-05-21T00:00:00+00:00","content":"https://obamawhitehouse.archives.gov/videos/2015/May/briefings/052115.mp3","author":"the White House"},{"page_link":"https://obamawhitehouse.archives.gov/photos-and-video/video/2015/05/19/press-briefing","title":"Press Briefing","published_date":"2015-05-19T00:00:00+00:00","content":"https://obamawhitehouse.archives.gov/videos/2015/May/briefings/051915.mp3","author":"the White House"},{"page_link":"https://obamawhitehouse.archives.gov/photos-and-video/video/2015/05/15/press-briefing-principal-deputy-press-secretary-eric-schultz","title":"Press Briefing by Principal Deputy Press Secretary Eric Schultz","published_date":"2015-05-15T00:00:00+00:00","content":"https://obamawhitehouse.archives.gov/videos/2015/May/briefings/051515.mp3","author":"the White House"},{"page_link":"https://obamawhitehouse.archives.gov/photos-and-video/video/2015/05/14/press-briefing","title":"Press Briefing","published_date":"2015-05-14T00:00:00+00:00","content":"https://obamawhitehouse.archives.gov/videos/2015/May/briefings/051415.mp3","author":"the White House"},{"page_link":"https://obamawhitehouse.archives.gov/photos-and-video/video/2015/05/13/press-briefing","title":"Press Briefing","published_date":"2015-05-13T00:00:00+00:00","content":"https://obamawhitehouse.archives.gov/videos/2015/May/briefings/051315.mp3","author":"the White House"},{"page_link":"https://obamawhitehouse.archives.gov/photos-and-video/video/2015/05/12/press-briefing","title":"Press Briefing","published_date":"2015-05-12T00:00:00+00:00","content":"https://obamawhitehouse.archives.gov/videos/2015/May/briefings/051215.mp3","author":"the White House"},{"page_link":"https://obamawhitehouse.archives.gov/photos-and-video/video/2015/05/11/press-briefing","title":"Press Briefing","published_date":"2015-05-11T00:00:00+00:00","content":"https://obamawhitehouse.archives.gov/videos/2015/May/briefings/051115.mp3","author":"the White House"},{"page_link":"https://obamawhitehouse.archives.gov/photos-and-video/video/2015/05/06/press-briefing","title":"Press Briefing","published_date":"2015-05-06T00:00:00+00:00","content":"https://obamawhitehouse.archives.gov/videos/2015/May/briefings/050615.mp3","author":"the White House"},{"page_link":"https://obamawhitehouse.archives.gov/photos-and-video/video/2015/05/05/press-briefing","title":"Press Briefing","published_date":"2015-05-05T00:00:00+00:00","content":"https://obamawhitehouse.archives.gov/videos/2015/May/briefings/050515.mp3","author":"the White House"},{"page_link":"https://obamawhitehouse.archives.gov/photos-and-video/video/2015/05/01/press-breifing","title":"Press Breifing","published_date":"2015-05-01T00:00:00+00:00","content":"https://obamawhitehouse.archives.gov/videos/2015/April/briefings/050115.mp3","author":"the White House"},{"page_link":"https://obamawhitehouse.archives.gov/photos-and-video/video/2015/04/30/press-breifing","title":"Press Breifing","published_date":"2015-04-30T00:00:00+00:00","content":"https://obamawhitehouse.archives.gov/videos/2015/April/briefings/043015.mp3","author":"the White House"},{"page_link":"https://obamawhitehouse.archives.gov/photos-and-video/video/2015/04/29/press-briefing","title":"Press Briefing","published_date":"2015-04-29T00:00:00+00:00","content":"https://obamawhitehouse.archives.gov/videos/2015/April/briefings/042915.mp3","author":"the White House"},{"page_link":"https://obamawhitehouse.archives.gov/photos-and-video/video/2015/04/27/press-briefing","title":"Press Briefing","published_date":"2015-04-27T00:00:00+00:00","content":"https://obamawhitehouse.archives.gov/videos/2015/April/briefings/042715.mp3","author":"the White House"},{"page_link":"https://obamawhitehouse.archives.gov/photos-and-video/video/2015/04/24/press-briefing","title":"Press Briefing","published_date":"2015-04-24T00:00:00+00:00","content":"https://obamawhitehouse.archives.gov/videos/2015/April/briefings/042415.mp3","author":"the White House"},{"page_link":"https://obamawhitehouse.archives.gov/photos-and-video/video/2015/04/23/press-briefing","title":"Press Briefing","published_date":"2015-04-23T00:00:00+00:00","content":"https://obamawhitehouse.archives.gov/videos/2015/April/briefings/042315.mp3","author":"the White House"},{"page_link":"https://obamawhitehouse.archives.gov/photos-and-video/video/2015/04/21/press-briefing","title":"Press Briefing","published_date":"2015-04-21T00:00:00+00:00","content":"https://obamawhitehouse.archives.gov/videos/2015/April/briefings/042115.mp3","author":"the White House"},{"page_link":"https://obamawhitehouse.archives.gov/photos-and-video/video/2015/04/20/press-briefing","title":"Press Briefing","published_date":"2015-04-20T00:00:00+00:00","content":"https://obamawhitehouse.archives.gov/videos/2015/April/briefings/042015.mp3","author":"the White House"},{"page_link":"https://obamawhitehouse.archives.gov/photos-and-video/video/2015/04/16/press-briefing","title":"Press Briefing","published_date":"2015-04-16T00:00:00+00:00","content":"https://obamawhitehouse.archives.gov/videos/2015/April/briefings/041615.mp3","author":"the White House"},{"page_link":"https://obamawhitehouse.archives.gov/photos-and-video/video/2015/04/14/press-briefing","title":"Press Briefing","published_date":"2015-04-14T00:00:00+00:00","content":"https://obamawhitehouse.archives.gov/videos/2015/April/briefings/041415.mp3","author":"the White House"},{"page_link":"https://obamawhitehouse.archives.gov/photos-and-video/video/2015/04/10/press-briefing","title":"Press Briefing","published_date":"2015-04-10T00:00:00+00:00","content":"https://obamawhitehouse.archives.gov/videos/2015/April/briefings/041015.mp3","author":"the White House"},{"page_link":"https://obamawhitehouse.archives.gov/photos-and-video/video/2015/04/08/press-briefing","title":"Press Briefing","published_date":"2015-04-08T00:00:00+00:00","content":"https://obamawhitehouse.archives.gov/videos/2015/April/briefings/040815.mp3","author":"the White House"},{"page_link":"https://obamawhitehouse.archives.gov/photos-and-video/video/2015/04/07/press-briefing","title":"Press Briefing","published_date":"2015-04-07T00:00:00+00:00","content":"https://obamawhitehouse.archives.gov/videos/2015/April/briefings/040715.mp3","author":"the White House"},{"page_link":"https://obamawhitehouse.archives.gov/photos-and-video/video/2015/04/06/press-briefings","title":"Press Briefings","published_date":"2015-04-06T00:00:00+00:00","content":"https://obamawhitehouse.archives.gov/videos/2015/April/briefings/040615.mp3","author":"the White House"},{"page_link":"https://obamawhitehouse.archives.gov/photos-and-video/video/2015/04/01/press-briefing","title":"Press Briefing","published_date":"2015-04-01T00:00:00+00:00","content":"https://obamawhitehouse.archives.gov/videos/2015/April/briefings/040115.mp3","author":"the White House"},{"page_link":"https://obamawhitehouse.archives.gov/photos-and-video/video/2015/03/31/press-briefing","title":"Press Briefing","published_date":"2015-03-31T00:00:00+00:00","content":"https://obamawhitehouse.archives.gov/videos/2015/March/briefings/033115.mp3","author":"the White House"},{"page_link":"https://obamawhitehouse.archives.gov/photos-and-video/video/2015/03/27/press-briefings","title":"Press Briefings","published_date":"2015-03-27T00:00:00+00:00","content":"https://obamawhitehouse.archives.gov/videos/2015/March/briefings/032715.mp3","author":"the White House"},{"page_link":"https://obamawhitehouse.archives.gov/photos-and-video/video/2015/03/25/press-briefing","title":"Press Briefing","published_date":"2015-03-25T00:00:00+00:00","content":"https://obamawhitehouse.archives.gov/videos/2015/March/briefings/032515.mp3","author":"the White House"},{"page_link":"https://obamawhitehouse.archives.gov/photos-and-video/video/2015/03/23/press-briefing","title":"Press Briefing","published_date":"2015-03-23T00:00:00+00:00","content":"https://obamawhitehouse.archives.gov/videos/2015/March/briefings/032315.mp3","author":"the White House"},{"page_link":"https://obamawhitehouse.archives.gov/photos-and-video/video/2015/03/20/press-briefing","title":"Press Briefing","published_date":"2015-03-20T00:00:00+00:00","content":"https://obamawhitehouse.archives.gov/videos/2015/March/briefings/032015.mp3","author":"the White House"},{"page_link":"https://obamawhitehouse.archives.gov/photos-and-video/video/2015/03/19/press-briefing","title":"Press Briefing","published_date":"2015-03-19T00:00:00+00:00","content":"https://obamawhitehouse.archives.gov/videos/2015/March/briefings/031915.mp3","author":"the White House"},{"page_link":"https://obamawhitehouse.archives.gov/photos-and-video/video/2015/03/17/press-briefing","title":"Press Briefing","published_date":"2015-03-17T00:00:00+00:00","content":"https://obamawhitehouse.archives.gov/videos/2015/March/briefings/031715.mp3","author":"the White House"},{"page_link":"https://obamawhitehouse.archives.gov/photos-and-video/video/2015/03/16/press-briefing","title":"Press Briefing","published_date":"2015-03-16T00:00:00+00:00","content":"https://obamawhitehouse.archives.gov/videos/2015/March/briefings/031615.mp3","author":"the White House"},{"page_link":"https://obamawhitehouse.archives.gov/photos-and-video/video/2015/03/11/press-briefing","title":"Press Briefing","published_date":"2015-03-11T00:00:00+00:00","content":"https://obamawhitehouse.archives.gov/videos/2015/March/briefings/031115.mp3","author":"the White House"},{"page_link":"https://obamawhitehouse.archives.gov/photos-and-video/video/2015/03/09/press-briefing","title":"Press Briefing","published_date":"2015-03-09T00:00:00+00:00","content":"https://obamawhitehouse.archives.gov/videos/2015/March/briefings/030915.mp3","author":"the White House"},{"page_link":"https://obamawhitehouse.archives.gov/photos-and-video/video/2015/03/04/press-briefing","title":"Press Briefing","published_date":"2015-03-04T00:00:00+00:00","content":"https://obamawhitehouse.archives.gov/videos/2015/March/briefings/030415.mp3","author":"the White House"},{"page_link":"https://obamawhitehouse.archives.gov/photos-and-video/video/2015/03/03/press-briefing","title":"Press Briefing","published_date":"2015-03-03T00:00:00+00:00","content":"https://obamawhitehouse.archives.gov/videos/2015/March/briefings/030315.mp3","author":"the White House"},{"page_link":"https://obamawhitehouse.archives.gov/photos-and-video/video/2015/03/02/press-briefing","title":"Press Briefing","published_date":"2015-03-02T00:00:00+00:00","content":"https://obamawhitehouse.archives.gov/videos/2015/March/briefings/030215.mp3","author":"the White House"},{"page_link":"https://obamawhitehouse.archives.gov/photos-and-video/video/2015/02/27/press-briefing","title":"Press Briefing","published_date":"2015-02-27T00:00:00+00:00","content":"https://obamawhitehouse.archives.gov/videos/2015/February/briefings/022715.mp3","author":"the White House"},{"page_link":"https://obamawhitehouse.archives.gov/photos-and-video/video/2015/02/26/press-briefing","title":"Press Briefing","published_date":"2015-02-26T00:00:00+00:00","content":"https://obamawhitehouse.archives.gov/videos/2015/February/briefings/022615.mp3","author":"the White House"},{"page_link":"https://obamawhitehouse.archives.gov/photos-and-video/video/2015/02/24/press-briefing","title":"Press Briefing","published_date":"2015-02-24T00:00:00+00:00","content":"https://obamawhitehouse.archives.gov/videos/2015/February/briefings/022415.mp3","author":"the White House"},{"page_link":"https://obamawhitehouse.archives.gov/photos-and-video/video/2015/02/23/press-briefing","title":"Press Briefing","published_date":"2015-02-23T00:00:00+00:00","content":"https://obamawhitehouse.archives.gov/videos/2015/February/briefings/022315.mp3","author":"the White House"},{"page_link":"https://obamawhitehouse.archives.gov/photos-and-video/video/2015/02/20/press-briefing","title":"Press Briefing","published_date":"2015-02-20T00:00:00+00:00","content":"https://obamawhitehouse.archives.gov/videos/2015/February/briefings/022015.mp3","author":"the White House"},{"page_link":"https://obamawhitehouse.archives.gov/photos-and-video/video/2015/02/18/press-briefing","title":"Press Briefing","published_date":"2015-02-18T00:00:00+00:00","content":"https://obamawhitehouse.archives.gov/videos/2015/February/briefings/021815.mp3","author":"the White House"},{"page_link":"https://obamawhitehouse.archives.gov/photos-and-video/video/2015/02/11/press-briefing","title":"Press Briefing","published_date":"2015-02-11T00:00:00+00:00","content":"https://obamawhitehouse.archives.gov/videos/2015/February/briefings/021115.mp3","author":"the White House"},{"page_link":"https://obamawhitehouse.archives.gov/photos-and-video/video/2015/02/10/press-briefing","title":"Press Briefing","published_date":"2015-02-10T00:00:00+00:00","content":"https://obamawhitehouse.archives.gov/videos/2015/February/briefings/021015.mp3","author":"the White House"},{"page_link":"https://obamawhitehouse.archives.gov/photos-and-video/video/2015/02/05/press-briefing","title":"Press Briefing","published_date":"2015-02-05T00:00:00+00:00","content":"https://obamawhitehouse.archives.gov/videos/2015/February/briefings/020515.mp3","author":"the White House"},{"page_link":"https://obamawhitehouse.archives.gov/photos-and-video/video/2015/02/04/press-briefing","title":"Press Briefing","published_date":"2015-02-04T00:00:00+00:00","content":"https://obamawhitehouse.archives.gov/videos/2015/February/briefings/020415.mp3","author":"the White House"},{"page_link":"https://obamawhitehouse.archives.gov/photos-and-video/video/2015/02/03/press-briefing","title":"Press Briefing","published_date":"2015-02-03T00:00:00+00:00","content":"https://obamawhitehouse.archives.gov/videos/2015/February/briefings/020315.mp3","author":"the White House"},{"page_link":"https://obamawhitehouse.archives.gov/photos-and-video/video/2015/02/02/senior-administration-officials-discuss-fy2016-budget","title":"Senior Administration Officials Discuss the FY2016 Budget","published_date":"2015-02-02T00:00:00+00:00","content":"https://obamawhitehouse.archives.gov/videos/2015/February/briefings/020215_Budget.mp3","author":"the White House"},{"page_link":"https://obamawhitehouse.archives.gov/photos-and-video/video/2015/01/30/press-briefing","title":"Press Briefing","published_date":"2015-01-30T00:00:00+00:00","content":"https://obamawhitehouse.archives.gov/videos/2015/January/briefings/013015.mp3","author":"the White House"},{"page_link":"https://obamawhitehouse.archives.gov/photos-and-video/video/2015/01/29/press-briefing","title":"Press Briefing","published_date":"2015-01-29T00:00:00+00:00","content":"https://obamawhitehouse.archives.gov/videos/2015/January/briefings/012915.mp3","author":"the White House"},{"page_link":"https://obamawhitehouse.archives.gov/photos-and-video/video/2015/01/28/press-briefing-principal-deputy-press-secretary-eric-schultz","title":"Press Briefing by Principal Deputy Press Secretary Eric Schultz","published_date":"2015-01-28T00:00:00+00:00","content":"https://obamawhitehouse.archives.gov/videos/2015/January/briefings/012815.mp3","author":"the White House"},{"page_link":"https://obamawhitehouse.archives.gov/photos-and-video/video/2015/01/26/press-briefing","title":"Press Briefing","published_date":"2015-01-26T00:00:00+00:00","content":"https://obamawhitehouse.archives.gov/videos/2015/January/briefings/012615.mp3","author":"the White House"},{"page_link":"https://obamawhitehouse.archives.gov/photos-and-video/video/2015/01/23/press-briefing","title":"Press Briefing","published_date":"2015-01-23T00:00:00+00:00","content":"https://obamawhitehouse.archives.gov/videos/2015/January/briefings/012315.mp3","author":"the White House"},{"page_link":"https://obamawhitehouse.archives.gov/photos-and-video/video/2015/01/15/press-briefing","title":"Press Briefing","published_date":"2015-01-15T00:00:00+00:00","content":"https://obamawhitehouse.archives.gov/videos/2015/January/briefings/011515.mp3","author":"the White House"},{"page_link":"https://obamawhitehouse.archives.gov/photos-and-video/video/2015/01/13/press-briefing","title":"Press Briefing","published_date":"2015-01-13T00:00:00+00:00","content":"https://obamawhitehouse.archives.gov/videos/2015/January/briefings/011315.mp3","author":"the White House"},{"page_link":"https://obamawhitehouse.archives.gov/photos-and-video/video/2015/01/12/press-briefing","title":"Press Briefing","published_date":"2015-01-12T00:00:00+00:00","content":"https://obamawhitehouse.archives.gov/videos/2015/January/briefings/011215.mp3","author":"the White House"},{"page_link":"https://obamawhitehouse.archives.gov/photos-and-video/video/2015/01/12/president-speaks-protecting-consumers-and-families-digital-age","title":"The President Speaks on Protecting Consumers and Families in the Digital Age","published_date":"2015-01-12T00:00:00+00:00","content":"https://obamawhitehouse.archives.gov/videos/2015/January/011215_FTC.mp3","author":"the White House"},{"page_link":"https://obamawhitehouse.archives.gov/photos-and-video/video/2015/01/06/press-briefing","title":"Press Briefing","published_date":"2015-01-06T00:00:00+00:00","content":"https://obamawhitehouse.archives.gov/videos/2015/January/briefings/010615.mp3","author":"the White House"},{"page_link":"https://obamawhitehouse.archives.gov/photos-and-video/video/2015/01/05/press-briefing","title":"Press Briefing","published_date":"2015-01-05T00:00:00+00:00","content":"https://obamawhitehouse.archives.gov/videos/2015/January/briefings/010515.mp3","author":"the White House"},{"page_link":"https://obamawhitehouse.archives.gov/photos-and-video/video/2014/12/19/president-obama-holds-2014-year-end-press-briefing","title":"President Obama Holds the 2014 Year-End Press Briefing","published_date":"2014-12-19T00:00:00+00:00","content":"https://obamawhitehouse.archives.gov/videos/2014/December/121914_PressConference.mp3","author":"the White House"},{"page_link":"https://obamawhitehouse.archives.gov/photos-and-video/video/2014/12/18/press-briefing","title":"Press Briefing","published_date":"2014-12-18T00:00:00+00:00","content":"https://obamawhitehouse.archives.gov/videos/2014/December/briefings/121814.mp3","author":"the White House"},{"page_link":"https://obamawhitehouse.archives.gov/photos-and-video/video/2014/12/17/press-briefing","title":"Press Briefing","published_date":"2014-12-17T00:00:00+00:00","content":"https://obamawhitehouse.archives.gov/videos/2014/December/briefings/121714.mp3","author":"the White House"},{"page_link":"https://obamawhitehouse.archives.gov/photos-and-video/video/2014/12/16/press-briefing","title":"Press Briefing","published_date":"2014-12-16T00:00:00+00:00","content":"https://obamawhitehouse.archives.gov/videos/2014/December/briefings/121614.mp3","author":"the White House"},{"page_link":"https://obamawhitehouse.archives.gov/photos-and-video/video/2014/12/12/press-briefing","title":"Press Briefing","published_date":"2014-12-12T00:00:00+00:00","content":"https://obamawhitehouse.archives.gov/videos/2014/December/briefings/121214.mp3","author":"the White House"},{"page_link":"https://obamawhitehouse.archives.gov/photos-and-video/video/2014/12/11/press-briefing","title":"Press Briefing","published_date":"2014-12-11T00:00:00+00:00","content":"https://obamawhitehouse.archives.gov/videos/2014/December/briefings/121114.mp3","author":"the White House"},{"page_link":"https://obamawhitehouse.archives.gov/photos-and-video/video/2014/12/10/press-briefing","title":"Press Briefing","published_date":"2014-12-10T00:00:00+00:00","content":"https://obamawhitehouse.archives.gov/videos/2014/December/briefings/121014.mp3","author":"the White House"},{"page_link":"https://obamawhitehouse.archives.gov/photos-and-video/video/2014/12/08/press-briefing","title":"Press Briefing","published_date":"2014-12-08T00:00:00+00:00","content":"https://obamawhitehouse.archives.gov/videos/2014/December/briefings/120814.mp3","author":"the White House"},{"page_link":"https://obamawhitehouse.archives.gov/photos-and-video/video/2014/12/05/press-briefing","title":"Press Briefing","published_date":"2014-12-05T00:00:00+00:00","content":"https://obamawhitehouse.archives.gov/videos/2014/December/briefings/120514.mp3","author":"the White House"},{"page_link":"https://obamawhitehouse.archives.gov/photos-and-video/video/2014/12/04/press-briefing","title":"Press Briefing","published_date":"2014-12-04T00:00:00+00:00","content":"https://obamawhitehouse.archives.gov/videos/2014/December/briefings/120414.mp3","author":"the White House"},{"page_link":"https://obamawhitehouse.archives.gov/photos-and-video/video/2014/12/03/press-briefing","title":"Press Briefing","published_date":"2014-12-03T00:00:00+00:00","content":"https://obamawhitehouse.archives.gov/videos/2014/December/briefings/120314.mp3","author":"the White House"},{"page_link":"https://obamawhitehouse.archives.gov/photos-and-video/video/2014/12/02/press-briefing","title":"Press Briefing","published_date":"2014-12-02T00:00:00+00:00","content":"https://obamawhitehouse.archives.gov/videos/2014/December/briefings/120214.mp3","author":"the White House"},{"page_link":"https://obamawhitehouse.archives.gov/photos-and-video/video/2014/12/01/press-briefing","title":"Press Briefing","published_date":"2014-12-01T00:00:00+00:00","content":"https://obamawhitehouse.archives.gov/videos/2014/December/briefings/120114.mp3","author":"the White House"},{"page_link":"https://obamawhitehouse.archives.gov/photos-and-video/video/2014/11/24/press-briefing","title":"Press Briefing","published_date":"2014-11-24T00:00:00+00:00","content":"https://obamawhitehouse.archives.gov/videos/2014/November/briefings/112414.mp3","author":"the White House"},{"page_link":"https://obamawhitehouse.archives.gov/photos-and-video/video/2014/11/19/press-briefing","title":"Press Briefing","published_date":"2014-11-19T00:00:00+00:00","content":"https://obamawhitehouse.archives.gov/videos/2014/November/briefings/111914.mp3","author":"the White House"},{"page_link":"https://obamawhitehouse.archives.gov/photos-and-video/video/2014/11/18/press-briefing","title":"Press Briefing","published_date":"2014-11-18T00:00:00+00:00","content":"https://obamawhitehouse.archives.gov/videos/2014/November/briefings/111814.mp3","author":"the White House"},{"page_link":"https://obamawhitehouse.archives.gov/photos-and-video/video/2014/11/13/press-briefing-naypyitaw-burma","title":"Press Briefing in Naypyitaw, Burma","published_date":"2014-11-13T00:00:00+00:00","content":"https://obamawhitehouse.archives.gov/videos/2014/November/briefings/111314.mp3","author":"the White House"},{"page_link":"https://obamawhitehouse.archives.gov/photos-and-video/video/2014/11/11/press-briefing-beijing-china","title":"Press Briefing in Beijing, China","published_date":"2014-11-11T00:00:00+00:00","content":"https://obamawhitehouse.archives.gov/videos/2014/November/briefings/111114.mp3","author":"the White House"},{"page_link":"https://obamawhitehouse.archives.gov/photos-and-video/video/2014/11/07/press-briefing","title":"Press Briefing","published_date":"2014-11-07T00:00:00+00:00","content":"https://obamawhitehouse.archives.gov/videos/2014/November/briefings/110714.mp3","author":"the White House"},{"page_link":"https://obamawhitehouse.archives.gov/photos-and-video/video/2014/11/06/press-briefing","title":"Press Briefing","published_date":"2014-11-06T00:00:00+00:00","content":"https://obamawhitehouse.archives.gov/videos/2014/November/briefings/110614.mp3","author":"the White House"},{"page_link":"https://obamawhitehouse.archives.gov/photos-and-video/video/2014/11/04/press-briefing","title":"Press Briefing","published_date":"2014-11-04T00:00:00+00:00","content":"https://obamawhitehouse.archives.gov/videos/2014/November/briefings/110414.mp3","author":"the White House"},{"page_link":"https://obamawhitehouse.archives.gov/photos-and-video/video/2014/11/03/press-briefing","title":"Press Briefing","published_date":"2014-11-03T00:00:00+00:00","content":"https://obamawhitehouse.archives.gov/videos/2014/November/briefings/110314.mp3","author":"the White House"},{"page_link":"https://obamawhitehouse.archives.gov/photos-and-video/video/2014/10/29/press-briefing","title":"Press Briefing","published_date":"2014-10-29T00:00:00+00:00","content":"https://obamawhitehouse.archives.gov/videos/2014/October/briefings/102914.mp3","author":"the White House"},{"page_link":"https://obamawhitehouse.archives.gov/photos-and-video/video/2014/10/28/press-briefing","title":"Press Briefing","published_date":"2014-10-28T00:00:00+00:00","content":"https://obamawhitehouse.archives.gov/videos/2014/October/briefings/102814.mp3","author":"the White House"},{"page_link":"https://obamawhitehouse.archives.gov/photos-and-video/video/2014/10/27/press-briefing","title":"Press Briefing","published_date":"2014-10-27T00:00:00+00:00","content":"https://obamawhitehouse.archives.gov/videos/2014/October/briefings/102714.mp3","author":"the White House"},{"page_link":"https://obamawhitehouse.archives.gov/photos-and-video/video/2014/10/24/press-briefing","title":"Press Briefing","published_date":"2014-10-24T00:00:00+00:00","content":"https://obamawhitehouse.archives.gov/videos/2014/October/briefings/102414.mp3","author":"the White House"},{"page_link":"https://obamawhitehouse.archives.gov/photos-and-video/video/2014/10/23/press-briefing","title":"Press Briefing","published_date":"2014-10-23T00:00:00+00:00","content":"https://obamawhitehouse.archives.gov/videos/2014/October/briefings/102314.mp3","author":"the White House"},{"page_link":"https://obamawhitehouse.archives.gov/photos-and-video/video/2014/10/22/press-briefing","title":"Press Briefing","published_date":"2014-10-22T00:00:00+00:00","content":"https://obamawhitehouse.archives.gov/videos/2014/October/briefings/102214.mp3","author":"the White House"},{"page_link":"https://obamawhitehouse.archives.gov/photos-and-video/video/2014/10/21/press-briefing","title":"Press Briefing","published_date":"2014-10-21T00:00:00+00:00","content":"https://obamawhitehouse.archives.gov/videos/2014/October/briefings/102114.mp3","author":"the White House"},{"page_link":"https://obamawhitehouse.archives.gov/photos-and-video/video/2014/10/17/press-briefing","title":"Press Briefing","published_date":"2014-10-17T00:00:00+00:00","content":"https://obamawhitehouse.archives.gov/videos/2014/October/briefings/101714.mp3","author":"the White House"},{"page_link":"https://obamawhitehouse.archives.gov/photos-and-video/video/2014/10/16/press-briefing","title":"Press Briefing","published_date":"2014-10-16T00:00:00+00:00","content":"https://obamawhitehouse.archives.gov/videos/2014/October/briefings/101614.mp3","author":"the White House"},{"page_link":"https://obamawhitehouse.archives.gov/photos-and-video/video/2014/10/15/press-briefing","title":"Press Briefing","published_date":"2014-10-15T00:00:00+00:00","content":"https://obamawhitehouse.archives.gov/videos/2014/October/briefings/101514.mp3","author":"the White House"},{"page_link":"https://obamawhitehouse.archives.gov/photos-and-video/video/2014/10/14/press-briefing","title":"Press Briefing","published_date":"2014-10-14T00:00:00+00:00","content":"https://obamawhitehouse.archives.gov/videos/2014/October/briefings/101414.mp3","author":"the White House"},{"page_link":"https://obamawhitehouse.archives.gov/photos-and-video/video/2014/10/08/press-briefing","title":"Press Briefing","published_date":"2014-10-08T00:00:00+00:00","content":"https://obamawhitehouse.archives.gov/videos/2014/October/briefings/100814.mp3","author":"the White House"},{"page_link":"https://obamawhitehouse.archives.gov/photos-and-video/video/2014/10/06/press-briefing","title":"Press Briefing","published_date":"2014-10-06T00:00:00+00:00","content":"https://obamawhitehouse.archives.gov/videos/2014/October/briefings/100614.mp3","author":"the White House"},{"page_link":"https://obamawhitehouse.archives.gov/photos-and-video/video/2014/10/01/press-briefing","title":"Press Briefing","published_date":"2014-10-01T00:00:00+00:00","content":"https://obamawhitehouse.archives.gov/videos/2014/October/briefings/100114.mp3","author":"the White House"},{"page_link":"https://o